Tool,keywords_score,Description,Topics,Type,Citations,URL,bio.tools URL,keyword_rank,citations_rank,Score
aiso,0.500,Interactive image segmentation tool designed to allow curators of biological specimens to segment and annotate image data with ontology terms.,"['Ontology and terminology', 'Biological imaging']",['Desktop application'],0.0,http://www.mybiosoftware.com/aiso-0-3-image-segmentation-tool.html,https://bio.tools/aiso,339.0,215.0,289.4
j-express,0.500,"It is a comprehensive portable software package for analysis and visualization of microarray data. It gives access to methods for unsupervised analysis, supervised analysis and visualisation in an integrated and flexible way. Its efficiency allows interactive clustering of thousands of expression profiles on standard personal computers. Supervised analysis can be performed on samples by simple sample annotation or on genes through tools for metabolic pathway analysis and Gene Ontology mapping.","['Mapping', 'Ontology and terminology', 'samples']",['Desktop application'],0.0,http://www.mybiosoftware.com/j-express-2009-analysis-visualization-microarray-data.html,https://bio.tools/j-express,339.0,215.0,289.4
nmrml converter,0.500,"This tool is used to support the nmrML data standard for nuclear magnetic resonance raw data in metabolomics. It converts native Bruker, Jeol and Agilent vendor formats into the open access nmrML data standard that is used by an ever-so growing number of small molecule NMR repositories.","['NMR', 'Analytical chemistry', 'Data integration and warehousing', 'Metabolomics', 'Ontology and terminology']",['Library'],8.0,https://github.com/nmrML/nmrML/tree/master/tools/Parser_and_Converters/Java,https://bio.tools/nmrml converter,339.0,261.0,307.8
nlimed,0.500,"Natural Language Interface for Model Entity Discovery in Biosimulation Model Repositories | This project is to convert user query to SPARQL in the Physiome Model Repository. The information looking by users usually is model entities | Natural Language Interface for Model Entity Discovery (NLIMED) is an interface to search model entities (i.e. flux of sodium across the basolateral plasma membrane, the concentration of potassium in the portion of tissue fluid) in the biosimulation models in repositories. The interface utilises the RDF inside biosimulation models and metadata from BioPortal. Currently, the interface can retrieve model entities from the Physiome Model Repository (PMR, https://models.physiomeproject.org) and the BioModels (https://www.ebi.ac.uk/biomodels/)","['Ontology and terminology', 'Natural language processing', 'Bioengineering']",['Command-line tool'],0.0,,https://bio.tools/nlimed,339.0,215.0,289.4
ontoget,0.500,Get ontology term(s).,['Ontology and terminology'],['Command-line tool'],4828.0,http://emboss.open-bio.org/html/adm/ch01s01.html,https://bio.tools/ontoget,339.0,378.0,354.6
mousebook,0.500,"The database and web portal provide access to information about mutant mouse lines held as live or cryopreserved stocks at MRC Harwell. It portal integrates curated information from the MRC Harwell stock resource, and other Harwell databases, with information from external data resources to provide value-added information.","['Genotype and phenotype', 'Ontology and terminology', 'Zoology', 'Genetic variation']",['Database portal'],12.0,,https://bio.tools/mousebook,339.0,270.0,311.4
hgv_david,0.500,This tool provides functional annotation for a list of genes by connecting with DAVID database.,"['Ontology and terminology', 'Gene expression']",['Web application'],15658.0,https://galaxy.pasteur.fr/tool_runner?tool_id=hgv_david,https://bio.tools/hgv_david,339.0,379.0,355.0
gcocoa,0.500,A tool of the g:Profiler web server. It enables to do functional annotation for several gene lists at the same time and compare their results.,"['Statistics and probability', 'Function analysis', 'Data identity and mapping', 'Data mining', 'Ontology and terminology']",['Web application'],238.0,,https://bio.tools/gcocoa,339.0,331.0,335.8
miringo,0.500,"Prediction of biological processes indirectly targeted by human microRNAs.

miRinGO: Prediction of GO terms indirectly targeted by human microRNAs.

This R Shiny application can be used to predict Gene Ontology (GO) terms indirectly targeted by human microRNAs. In contrast to direct targets which are predicted to have binding sites, indirect targets are regulated transcriptionally through transcription factors (TFs).","['Gene transcripts', 'Functional, regulatory and non-coding RNA', 'RNA-Seq', 'Ontology and terminology', 'Gene expression']","['Library', 'Desktop application']",0.0,,https://bio.tools/miringo,339.0,215.0,289.4
emma2 ws,0.500,A MAGE-compliant system for the collaborative analysis and integration of microarray data.,"['Data management', 'Ontology and terminology', 'Microarray experiment']",['Web service'],0.0,https://www.biocatalogue.org/services/3747,https://bio.tools/emma2 ws,339.0,215.0,289.4
acela,0.500,Tool that aims to reduce the human effort required to produce a gold standard corpus of named entity (NE) annotations.,"['Molecular interactions, pathways and networks', 'Natural language processing', 'Machine learning', 'Human biology', 'Ontology and terminology']",['Web application'],7.0,,https://bio.tools/acela,339.0,258.0,306.6
pubrecheck,0.500,"How to improve automated discoverability and interpretability.

Data-driven research in biomedical science requires structured, computable data. Increasingly, these data are created with support from automated text mining. Text-mining tools have rapidly matured: although not perfect, they now frequently provide outstanding results. We describe 10 straightforward writing tips-and a web tool, PubReCheck-guiding authors to help address the most common cases that remain difficult for text-mining tools. We anticipate these guides will help authors' work be found more readily and used more widely, ultimately increasing the impact of their work and the overall benefit to both authors and readers.","['Medicine', 'Natural language processing', 'Biomedical science', 'Data mining', 'Ontology and terminology']",[],0.0,,https://bio.tools/pubrecheck,339.0,215.0,289.4
edamisformat,0.500,Find EDAM ontology terms by is_format_of relation.,['Ontology and terminology'],['Command-line tool'],4828.0,http://emboss.open-bio.org/html/adm/ch01s01.html,https://bio.tools/edamisformat,339.0,378.0,354.6
seaweb,0.500,"the small RNA Expression Atlas web application.

Sign in with Google or with you SEA account below. If you have not created an account yet, then please register first.

If you have received an eMail from Oasis 2 that the classification or DE analysis results are downloadable, you can provide the given link here, in order to upload the output to this system and compare them with publically available datasets.

SEA (also SEAweb) is a searchable database for the expression of small RNA (miRNA, piRNA, snoRNA, snRNA, siRNA) and pathogens. Publically available sRNA sequencing datasets were analysed with Oasis 2 pipelines and the results are stored here for easy and comparable search. Our curated, ontology connected metadata enables powerful searches within this database. Learn more in the documentation and publication","['Gene transcripts', 'Functional, regulatory and non-coding RNA', 'RNA-Seq', 'Biomarkers', 'Ontology and terminology']",[],0.0,,https://bio.tools/seaweb,339.0,215.0,289.4
arachnoserver,0.500,"ArachnoServer is a manually curated database providing information on the sequence, structure and biological activity of protein toxins from spider venoms. Key features of ArachnoServer include a molecular target ontology designed specifically for venom toxins, current and historic taxonomic information and a powerful advanced search interface.","['Ontology and terminology', 'Zoology', 'Proteins', 'Small molecules']",['Database portal'],163.0,,https://bio.tools/arachnoserver,339.0,326.0,333.8
ontogetroot,0.500,Get ontology root terms by child identifier.,['Ontology and terminology'],['Command-line tool'],4828.0,http://emboss.open-bio.org/html/adm/ch01s01.html,https://bio.tools/ontogetroot,339.0,378.0,354.6
bio.tools,0.500,The community registry of computational tools and data resources for biosciences.,"['Computational biology', 'Ontology and terminology', 'Data submission, annotation and curation', 'Bioinformatics']","['Web API', 'Web application', 'Database portal']",55.0,https://biotools.readthedocs.io/en/latest/support.html?highlight=help,https://bio.tools/bio.tools,339.0,305.0,325.4
pyradiomics,0.500,PyRadiomics is an ontology-guided radiomics analysis workflow (O-RAW).,"['Oncology', 'Medical imaging', 'Workflows', 'Genotype and phenotype', 'Ontology and terminology']",[],3.0,,https://bio.tools/pyradiomics,339.0,243.0,300.6
jmztab-m,0.500,Reference implementation for mzTab 2.0 for metabolomics,"['Metabolomics', 'Ontology and terminology', 'Data submission, annotation and curation']","['Command-line tool', 'Library']",0.0,https://github.com/lifs-tools/jmzTab-m,https://bio.tools/jmztab-m,339.0,215.0,289.4
ratspub,0.500,"a webservice aided by deep learning to mine PubMed for addiction-related genes.

RatsPub: Relationship with Addiction Through Searches of PubMed.

RatsPub searches PubMed to find sentences that contain the query terms (e.g., gene symbols) and a drug addiction related keyword. Over 300 of these keywords are organized into six categories:.

RatsPub is a tool to efficiently and comprehensively answer the question ""What do we know about these genes and addiction?"".

RatsPub answers this question by searching PubMed to find sentences containing the query terms (i.e., gene symbols) and over 300 drug addiction-related keywords that are organized into six categories. Data from NHGRI-EBI GWAS catalog are also included in the search. These gene-keyword relationships are presented as an interactive graph and a table.","['GWAS study', 'Natural language processing', 'Machine learning', 'Metabolomics', 'Ontology and terminology']",[],0.0,http://rats.pub,https://bio.tools/ratspub,339.0,215.0,289.4
loinc2hpo,0.500,Annotation tool that recommends candidate Human Phenotype Ontology (HPO) terms to a LOINC (Laboratory Observation Identifier Names and Codes) test based on lexical matching between HPO term definitions and the name of a laboratory test.,"['Rare diseases', 'Genotype and phenotype', 'Ontology and terminology', 'Biomarkers']",['Library'],0.0,https://github.com/TheJacksonLaboratory/loinc2hpoAnnotation/issues,https://bio.tools/loinc2hpo,339.0,215.0,289.4
hipathia,0.500,Hipathia is a method for the computation of signal transduction along signaling pathways from transcriptomic data. The method is based on an iterative algorithm which is able to compute the signal intensity passing through the nodes of a network by taking into account the level of expression of each gene and the intensity of the signal arriving to it. It also provides a new approach to functional analysis allowing to compute the signal arriving to the functions annotated to each pathway.,"['Molecular interactions, pathways and networks', 'Ontology and terminology', 'Gene expression']",['Library'],12.0,http://bioconductor.org/packages/hipathia/,https://bio.tools/hipathia,339.0,270.0,311.4
biomoby,0.500,"BioMOBY is an international research project involving biological data hosts, biological data service providers, and coders whose aim is to explore various methodologies for biological data representation, distribution, and discovery.","['Informatics', 'Molecular interactions, pathways and networks', 'Sequence assembly', 'Database management', 'Ontology and terminology']",['Web application'],290.0,,https://bio.tools/biomoby,339.0,335.0,337.4
coeus,0.500,"Semantic web application network that combines a set of algorithms to streamline the creation of new semantic web-based knowledge management systems. In a single package, it provides the tools to create new applications, including advanced integration connectors for different data sources along with ontology mapping techniques.","['Informatics', 'Data integration and warehousing', 'Rare diseases', 'Ontology and terminology', 'Software engineering']","['Web application', 'Database portal']",31.0,https://github.com/bioinformatics-ua/COEUS,https://bio.tools/coeus,339.0,294.0,321.0
genex_ontology,0.500,"Enabling semantic queries across federated bioinformatics databases.

Ontology Documentation generated by WIDOCO.

Gene expression (GenEx) semantic model.","['Database management', 'Ontology and terminology', 'Gene expression']",[],1.0,,https://bio.tools/genex_ontology,339.0,227.0,294.20000000000005
go2vec,0.500,"transforming GO terms and proteins to vector representations via graph embeddings.

BACKGROUND:Semantic similarity between Gene Ontology (GO) terms is a fundamental measure for many bioinformatics applications, such as determining functional similarity between genes or proteins. Most previous research exploited information content to estimate the semantic similarity between GO terms; recently some research exploited word embeddings to learn vector representations for GO terms from a large-scale corpus. In this paper, we proposed a novel method, named GO2Vec, that exploits graph embeddings to learn vector representations for GO terms from GO graph. GO2Vec combines the information from both GO graph and GO annotations, and its learned vectors can be applied to a variety of bioinformatics applications, such as calculating functional similarity between proteins and predicting protein-protein interactions","['Protein interactions', 'Ontology and terminology', 'Machine learning', 'Model organisms']",['Command-line tool'],1.0,,https://bio.tools/go2vec,339.0,227.0,294.20000000000005
belief,0.500,BELIEF (Biological Expression Language Information Extraction WorkFlow) is a semi-automated workflow for BEL network creation. It embeds an information extraction workflow with state-of-the-art named entity recognition (NER) and relation extraction (RE) methods.,"['Natural language processing', 'Machine learning', 'Workflows', 'Genotype and phenotype', 'Ontology and terminology']",['Web application'],0.0,,https://bio.tools/belief,339.0,215.0,289.4
gosemsim,0.500,"The semantic comparisons of Gene Ontology (GO) annotations provide quantitative ways to compute similarities between genes and gene groups, and have became an important basis for many bioinformatics analysis approaches. This R package analyzes the semantic similarity computation among GO terms, sets of GO terms, gene products and gene clusters.",['Ontology and terminology'],"['Command-line tool', 'Library']",288.0,https://guangchuangyu.github.io/GOSemSim,https://bio.tools/gosemsim,339.0,334.0,337.0
gofuncr,0.500,"It performs a gene ontology enrichment analysis based on the ontology enrichment software FUNC. GO-annotations are obtained from OrganismDb or OrgDb packages; the GO-graph is included in the package and updated regularly. GOfuncR provides the standard candidate vs. background enrichment analysis using the hypergeometric test, as well as three additional tests.",['Ontology and terminology'],['Library'],0.0,http://bioconductor.org/packages/GOfuncR/,https://bio.tools/gofuncr,339.0,215.0,289.4
gorilla,0.500,Tool for identifying and visualizing enriched GO terms in ranked lists of genes.,"['Molecular interactions, pathways and networks', 'Ontology and terminology', 'Functional genomics']",['Web application'],1230.0,,https://bio.tools/gorilla,339.0,356.0,345.8
g2g,0.500,G2G is a tool to predict genetic interactions that is based on mapping genes to Gene Ontology (GO) terms and using this mapping for genotype to phenotype predictions.,"['Molecular interactions, pathways and networks', 'Mapping', 'Model organisms', 'Ontology and terminology', 'Gene expression']",['Web application'],0.0,,https://bio.tools/g2g,339.0,215.0,289.4
floritaly,0.500,"FlorItaly is a data portal for the flora of Italy. This portal organises nomenclatural and distributional data from the recent checklists of the Italian native and alien vascular plants (and their subsequent updatings), with links to resources from other projects.","['Biodiversity', 'Plant biology', 'Ontology and terminology']",['Database portal'],0.0,,https://bio.tools/floritaly,339.0,215.0,289.4
a4preproc,0.500,"An R package of the ""a4"" packages collection. It is used for microarray data preprocessing where annotation information is added to experimental result data.","['Ontology and terminology', 'Microarray experiment']","['Command-line tool', 'Library']",671.0,,https://bio.tools/a4preproc,339.0,348.0,342.6
foldgo,0.500,FoldGO is a web tool for fold-change-specific functional enrichment analysis of transcriptome. FoldGO identifies gene ontology (GO) terms specifically enriched in sets of genes with a similar fold-changes in response to a stimulus.,"['Transcription factors and regulatory sites', 'Gene regulation', 'RNA-Seq', 'Ontology and terminology', 'Transcriptomics']",['Web application'],0.0,,https://bio.tools/foldgo,339.0,215.0,289.4
ontocat,0.500,"This package provides a simple interface to ontologies described in widely used standard formats, stored locally in the filesystem or accessible online.","['Function analysis', 'Ontology and terminology']","['Command-line tool', 'Library']",6.0,,https://bio.tools/ontocat,339.0,253.0,304.6
bioecs,0.500,"An ad hoc search engine to help biologists to isolate EST clusters corresponding to their research target, based on cross references between TIGR and Unigene.","['Sequences', 'References', 'EST', 'Biology', 'Ontology and terminology']",['Desktop application'],0.0,http://www.mybiosoftware.com/bioecs-1-0-biology-easy-cluster-search.html,https://bio.tools/bioecs,339.0,215.0,289.4
ontogetobsolete,0.500,Get ontology ontology terms.,['Ontology and terminology'],['Command-line tool'],4828.0,http://emboss.open-bio.org/html/adm/ch01s01.html,https://bio.tools/ontogetobsolete,339.0,378.0,354.6
classyfire,0.500,"A webapplication for automated structural classification of chemical entities. This application uses a rule-based approach that relies on a comprehensible, comprehensive, and computable chemical taxonomy.","['Taxonomy', 'Small molecules', 'Cheminformatics', 'Chemistry', 'Ontology and terminology']","['Web application', 'Web API']",0.0,,https://bio.tools/classyfire,339.0,215.0,289.4
anddigest,0.500,"A web-based module of ANDSystem for the search of knowledge in the scientific literature.
The rapid growth of scientific literature has rendered the task of finding relevant information one of the critical problems in almost any research. Search engines, like Google Scholar, Web of Knowledge, PubMed, Scopus, and others, are highly effective in document search; however, they do not allow knowledge extraction. In contrast to the search engines, text-mining systems provide extraction of knowledge with representations in the form of semantic networks. Of particular interest are tools performing a full cycle of knowledge management and engineering, including automated retrieval, integration, and representation of knowledge in the form of semantic networks, their visualization, and analysis. STRING, Pathway Studio, MetaCore, and others are well-known examples of such products","['Molecular interactions, pathways and networks', 'Natural language processing', 'Machine learning', 'Data mining', 'Ontology and terminology']",[],0.0,,https://bio.tools/anddigest,339.0,215.0,289.4
gotools,0.500,Wraper functions for description/comparison of oligo ID list using Gene Ontology database.,"['Ontology and terminology', 'Genotyping experiment', 'Microarray experiment', 'Gene expression']","['Command-line tool', 'Library']",671.0,,https://bio.tools/gotools,339.0,348.0,342.6
dnatraffic,0.500,"Database dedicated to comprehensive and rich annotations of genome dynamics during cell life. DNAtraffic contains extensive data on the nomenclature, ontology, structure and function of proteins related to control of the DNA integrity mechanisms such as chromatin remodeling, DNA repair and damage response pathways from eight model organisms commonly used in the DNA-related study.","['Pathology', 'Molecular interactions, pathways and networks', 'Epigenetics', 'Model organisms', 'Ontology and terminology']",['Database portal'],2.0,,https://bio.tools/dnatraffic,339.0,236.0,297.8
ontoquestmain,0.500,Search terms starting for the query used for auto-complete service.,"['Data mining', 'Data management', 'Ontology and terminology']",['Web API'],0.0,https://www.biocatalogue.org/services/2715,https://bio.tools/ontoquestmain,339.0,215.0,289.4
ikap_cells,0.500,"IKAP - Identifying K mAjor cell Population groups in single-cell RNA-seq analysis.

IKAP – Identifying K mAjor cell Population groups in single-cell RNA-seq analysis.

Note: IKAP will, by default, regress out the percentage of mitochondrial gene counts and total UMI counts and scale the expression matrix using Seurat ScaleData function. These two values should be save in Seurat metadata with column names 'percent.mito' and 'nUMI' respectively. If you want to regress out different confounding variables or use different column names, please save these variables in Seurat metadata and set 'confounders' (an IKAP parameter) as their column names in the Seurat metadata data frame.","['RNA-Seq', 'Transcriptomics', 'Ontology and terminology', 'Cell biology']",['Library'],0.0,,https://bio.tools/ikap_cells,339.0,215.0,289.4
doubler,0.500,DOUBLER is a tool for Unified Representation Learning of Biological Entities and Documents for Predicting Protein–Disease Relationships.,"['Pathology', 'Genotype and phenotype', 'Ontology and terminology', 'Machine learning']",['Script'],0.0,,https://bio.tools/doubler,339.0,215.0,289.4
gsan,0.500,Gene Set Annotation - an alternative to enrichment analysis for annotating gene sets.,"['Molecular interactions, pathways and networks', 'Genotype and phenotype', 'Ontology and terminology']",['Web application'],0.0,https://gsan.labri.fr/start,https://bio.tools/gsan,339.0,215.0,289.4
sem1r,0.500,"Finding semantic patterns in omics data using concept rule learning with an ontology-based refinement operator.

sem1R is a machine learning algorithm that finds interesting, hidden, and non-trivial semantic patterns in omics data.","['Taxonomy', 'Machine learning', 'RNA-Seq', 'Ontology and terminology', 'Gene expression']",[],0.0,,https://bio.tools/sem1r,339.0,215.0,289.4
sbgn bricks,0.500,"SBGN Bricks Ontology as a tool to describe recurring concepts in molecular networks.

SBGN Bricks aims at facilitating the development of new tools for the template-based construction of molecular networks and for their semantic annotation. It is also intended as a teaching aid for those learning SBGN and systems biology.

SBGN bricks are building blocks representing basic biological patterns. They can be used for assembly into different kinds of networks (metabolic, regulatory networks).","['Endocrinology and metabolism', 'Systems biology', 'Transcription factors and regulatory sites', 'Molecular interactions, pathways and networks', 'Ontology and terminology']",[],0.0,http://sbgnbricks.sourceforge.net,https://bio.tools/sbgn bricks,339.0,215.0,289.4
generic go term mapper,0.500,"A tool for mapping the granular GO annotations for genes in a list to a set of broader, high-level GO parents terms.",['Ontology and terminology'],['Web application'],0.0,,https://bio.tools/generic go term mapper,339.0,215.0,289.4
lipid mini-on,0.500,Lipid Mining and Ontology (Lipid Mini-On) - mining and ontology tool for enrichment analysis of lipidomic data.,"['Ontology and terminology', 'Lipids']","['Web application', 'Web service']",0.0,https://github.com/PNNL-Comp-Mass-Spec/LipidMiniOn/issues,https://bio.tools/lipid mini-on,339.0,215.0,289.4
semdist,0.500,"This package implements methods to calculate information accretion for a given version of the gene ontology and uses this data to calculate remaining uncertainty, misinformation, and semantic similarity for given sets of predicted annotations and true annotations from a protein function predictor.","['Ontology and terminology', 'Data quality management']","['Command-line tool', 'Library']",671.0,http://github.com/iangonzalez/SemDist,https://bio.tools/semdist,339.0,348.0,342.6
gostats,0.500,"A set of tools for interacting with GO and microarray data. A variety of basic manipulation tools for graphs, hypothesis testing and other simple calculations.","['Ontology and terminology', 'Data quality management']","['Command-line tool', 'Library']",979.0,,https://bio.tools/gostats,339.0,353.0,344.6
diversityscientificterms,0.500,"DiversityScientificTerms (DWB-DST) is an application of Diversity Workbench (DWB). It might be installed as part of a DWB environment, but also as a stand-alone application, e. g., in a local installation. Each DWB module is devoted to a specific data domain. DST is focussed on the management of collections of scientific terms and term concepts, i. e., particular domain-specific  terminologies, glossaries and vocabularies (e.g. biostratigraphy, anatomical terminology). DST is able to organise terms together with synonyms, common names and equivalent  terms ín different languages. The single terms are defined, (hierarchically) classified and referenced, for example, by linking online resources and external identifiers.","['Medicine', 'Environmental science', 'Data management', 'Biology', 'Chemistry', 'Ontology and terminology']",['Desktop application'],0.0,https://diversityworkbench.net/Portal/Support,https://bio.tools/diversityscientificterms,339.0,215.0,289.4
