Tool,keywords_score,Description,Topics,Type,Citations,URL,bio.tools URL,keyword_rank,citations_rank,Score
ngly1,0.900,"Structured Reviews for Data and Knowledge Driven Research | The NGLY1 Deficiency Knowledge Graph | This is the repository for the NGLY1 Deficiency Knowledge Graph, the reasoning context to support hypothesis discovery for NGLY1 Deficiency-CDDG (DOID:0060728) research. The user can navigate the knowledge in the graph in the Neo4j Browser website. This knowledge graph is a structured review around the research question what is the mechanism underpinning the NGLY1-AQP1 regulation association and explaining the reduced transcriptomic expression of multiple Aquaporins in NGLY1 deficient cells?. The graph v3.2 is the first deployed in the Wikibase application for community contribution and curation","['Molecular interactions, pathways and networks', 'Ontology and terminology', 'Machine learning']",['Command-line tool'],0.0,https://github.com/SuLab/ngly1-graph,https://bio.tools/ngly1,380.0,215.0,314.0
ontokin,0.900,"An Ontology for Chemical Kinetic Reaction Mechanisms.

A knowledge-graph built with the integration of semantic technologies and software agents for enhancing the experience of chemists in querying chemical kinetic reaction mechanisms. This User Interface (UI) demonstrates the query capability of OntoKin","['Literature and language', 'Small molecules', 'Enzymes', 'Chemistry', 'Ontology and terminology']",['Web application'],0.0,http://theworldavatar.com/ontokin,https://bio.tools/ontokin,380.0,215.0,314.0
do,0.850,"The Disease Ontology (DO) has been developed as a standardized ontology for human disease with the purpose of providing the biomedical community with consistent, reusable and sustainable descriptions of human disease terms, phenotype characteristics and related medical vocabulary disease concepts.","['Pathology', 'Molecular interactions, pathways and networks', 'Rare diseases', 'Medical informatics', 'Ontology and terminology']","['Web application', 'Database portal']",436.0,,https://bio.tools/do,378.0,341.0,363.2
hio,0.850,"A Tool for Unifying Hearing Impairment Knowledge to Enhance Collaborative Research.

The Hearing Impairment Ontology (HIO) is a collaboratively developed resource by a group of experts in different aspects of hearing impairment (HI) to provide a common controlled HI terminology and concepts. The HIO will allow researchers and clinicians alike to readily access standardised HI-related knowledge in a single location and promote collaborations and HI information sharing, including epidemiological, socio-environmental, biomedical, genetic and phenotypic information. It is worth noting, this ontology provides an illustration of the adaptability of the Sickle Cell Disease Ontology framework for use in developing a disease-specific ontology.","['Pathology', 'Transcription factors and regulatory sites', 'Public health and epidemiology', 'Genotype and phenotype', 'Ontology and terminology']",['Command-line tool'],0.0,https://github.com/hiodev/hi-ontology,https://bio.tools/hio,378.0,215.0,312.79999999999995
ohd,0.850,"Structuring, reuse and analysis of electronic dental data using the Oral Health and Disease Ontology.

We need a standardized approach that enables efficient access to information in Electronic Dental Records, and integration across different dental care providers and EHR systems.","['Biological databases', 'Dentistry', 'Medicines research and development', 'Medical informatics', 'Ontology and terminology']",['Library'],0.0,https://github.com/oral-health-and-disease-ontologies/ohd-ontology/blob/master/src/analysis/survival.r,https://bio.tools/ohd,378.0,215.0,312.79999999999995
doc2hpo,0.850,Web application for efficient and accurate Human Phenotype Ontology (HPO) concept curation.,"['Genotype and phenotype', 'Ontology and terminology', 'Natural language processing']",['Web application'],2.0,https://github.com/stormliucong/doc2hpo,https://bio.tools/doc2hpo,378.0,236.0,321.2
amigo 2,0.850,The GO Consortium GO browser and search engine.,['Ontology and terminology'],['Web application'],743.0,,https://bio.tools/amigo 2,378.0,349.0,366.4
plangexq,0.850,PlanGexQ is a user-friendly interactive tool for the curation and annotation of planarian morphologies and gene expression patterns in a centralized database. PlanGexQ allows any user to define reference morphologies using mathematical graphs and a drag-and-drop interface. Gene expression pattern images can be uploaded to the program and then registered into the reference morphologies. Annotations with terms from the planarian anatomy ontology are autommatically created by analyzing the gene expression patterns and their textual descriptions. PlanGexQ represents a complete methodology for centralizing with formal and annotated descriptions the morphologies and gene expression patterns of planarian worms.,"['Mathematics', 'Genotype and phenotype', 'Model organisms', 'Ontology and terminology', 'Gene expression']",[],0.0,,https://bio.tools/plangexq,378.0,215.0,312.79999999999995
gene ontology (go),0.850,"The Gene Ontology Consortium continues to develop, maintain and use a set of structured, controlled vocabularies for the annotation of genes, gene products and sequences. Several new relationship types have been introduced and used, along with existing relationships, to create links between and within the domains. Gene product annotation continues to increase both in the number of total annotations and in species coverage. Tools have seen major improvements in functionality, speed and usage.","['Gene structure', 'Small molecules', 'Zoology', 'Ontology and terminology', 'Gene expression']",['Database portal'],483.0,,https://bio.tools/gene ontology (go),378.0,342.0,363.6
gocats,0.850,Advances in gene ontology utilization improve statistical power of annotation enrichment | Welcome to GOcats’ documentation! — GOcats 1.1.5 documentation,"['Mapping', 'Ontology and terminology', 'Microarray experiment']",['Command-line tool'],2.0,,https://bio.tools/gocats,378.0,236.0,321.2
rdfscape,0.850,"This is a project that brings Semantic Web “features” to the popular Systems Biology software Cytoscape. It allows to query, visualize and reason on ontologies represented in OWL or RDF within Cytoscape.","['Systems biology', 'Ontology and terminology', 'Biology']",['Desktop application'],30.0,http://www.mybiosoftware.com/rdfscape-0-4-2-semantic-web-meets-systems-biology.html,https://bio.tools/rdfscape,378.0,291.0,343.2
ontobrowser,0.850,"The tool was developed to manage ontologies (and controlled terminologies e.g. CDISC SEND). The primary goal of the tool is to provide an online collaborative solution for expert curators to map code list terms (sourced from multiple systems/databases) to preferred ontology terms. Other key features include visualisation of ontologies in hierarchical/graph format, advanced search capabilities, peer review/approval workflow and web service access to data.","['Ontology and terminology', 'Data identity and mapping']","['Web API', 'Web application']",0.0,https://github.com/Novartis/ontobrowser,https://bio.tools/ontobrowser,378.0,215.0,312.79999999999995
fasto,0.850,FHIR And SSN based Type 1 diabetes Ontology (FASTO) is an OWL 2 ontology for real time management of insulin for diabetes patients especially type 1 diabetics.,"['Allergy, clinical immunology and immunotherapeutics', 'Ontology and terminology', 'Surgery']",['Ontology'],2.0,,https://bio.tools/fasto,378.0,236.0,321.2
gbol,0.850,"The Empusa code generator and its application to GBOL.

GBOL; Genome Biology Ontology Language.

To enable interoperability of genome annotations, we have developed the Genome Biology Ontology Language (GBOL) and associated stack (GBOL stack).

A group is a collection of several projects.

If you organize your projects under a group, it works like a folder.","['Model organisms', 'Ontology and terminology', 'Cell biology', 'Genomics']",['Ontology'],1.0,http://www.gitlab.com/GBOL,https://bio.tools/gbol,378.0,227.0,317.6
predictprotein open,0.850,Prediction of various aspects of protein structure and function. A user may submit a query to the server without registration.,"['Sequence analysis', 'Function analysis', 'Machine learning', 'Structure analysis', 'Proteins', 'Data mining', 'Ontology and terminology', 'Data visualisation']",['Web application'],1452.0,,https://bio.tools/predictprotein open,378.0,358.0,370.0
iot-stream,0.850,"A Lightweight Ontology for Internet of Things Data Streams and Its Use with Data Analytics and Event Detection Services.

A Lightweight Ontology for IoT Data Streams.

T. Elsaleh, M. Bermudez-Edo, S. Enshaeifar, S. T. Acton, R. Rezvani and P. Barnaghi, ""IoT-Stream: A Lightweight Ontology for Internet of Things Data Streams,"" 2019 Global IoT Summit (GIoTS), Aarhus, Denmark, 2019, pp. 1-6.

||| CORRECT NAME OF TOOL COULD ALSO BE 'IoT' (bio.tools/IoT)","['Workflows', 'Model organisms', 'Ontology and terminology']",['Web service'],0.0,http://purl.org/iot/ontology/iot-stream,https://bio.tools/iot-stream,378.0,215.0,312.79999999999995
the brenda tissue ontology (bto),0.850,"BRENDA Tissue Ontology is a structured encyclopedia of tissue terms. BTO contains different anatomical structures, tissues, cell types and cell lines, classified under generic categories corresponding to the rules and formats of the Gene Ontology Consortium and organized as a directed acyclic graph (DAG). A versatile web interface with several search and navigation functionalities allows convenient online access to the BTO and to the enzymes isolated from the tissues.","['Biobank', 'Enzymes', 'Microarray experiment', 'Model organisms', 'Ontology and terminology']",['Database portal'],66.0,,https://bio.tools/the brenda tissue ontology (bto),378.0,308.0,350.0
quickgo,0.850,A fast browser for Gene Ontology terms and annotations.,['Ontology and terminology'],['Web application'],315.0,,https://bio.tools/quickgo,378.0,336.0,361.2
clinical metadata ontology (cmdo),0.850,A simple classification scheme for data elements of clinical data based on semantics,"['Allergy, clinical immunology and immunotherapeutics', 'Ontology and terminology', 'Preclinical and clinical studies']",['Ontology'],0.0,http://bioportal.bioontology.org/ontologies/CMDO/,https://bio.tools/clinical metadata ontology (cmdo),378.0,215.0,312.79999999999995
gsso,0.850,"The Gender, Sex, and Sexual Orientation (GSSO) Ontology | GSSO is the Gender, Sex, and Sex Orientation ontology, including terms related to gender identity and expression, sexual and romantic identity and orientation, and sexual and reproductive behavior | Gender, Sex, and Sexual Orientation","['Pathology', 'Ontology and terminology', 'Gender medicine']",['Command-line tool'],1.0,,https://bio.tools/gsso,378.0,227.0,317.6
robot,0.850,"A Tool for Automating Ontology Workflows | ROBOT is a tool for working with Open Biomedical Ontologies | R.C. Jackson, J.P. Balhoff, E. Douglass, N.L. Harris, C.J. Mungall, and J.A. Overton. ROBOT: A tool for automating ontology workflows. BMC Bioinformatics, vol. 20, July 2019 | ROBOT is a tool for working with Open Biomedical Ontologies. It can be used as a command-line tool or as a library for any language on the Java Virtual Machine | If no --reasoner is provided, ROBOT will default to ELK. The following other reasoner options are supported: | ROBOT will always perform a logical validation check prior to automatic classification | Equivalent Classes (--equivalent-classes-allowed) | Generated Axioms(--axiom-generators)","['Workflows', 'Ontology and terminology', 'Software engineering']",[],0.0,http://robot.obolibrary.org/reason,https://bio.tools/robot,378.0,215.0,312.79999999999995
fobi,0.850,FOBI (Food-Biomarker Ontology) an ontology to represent food intake data and associate it with metabolomic data. It is composed of  two interconnected sub-ontologies. One is a “Food Ontology” consisting of raw foods and prepared foods while the second is a “Biomarker Ontology” containing food intake biomarkers classified by their chemical classes.,"['Small molecules', 'Metabolomics', 'Biomarkers', 'Nutritional science', 'Ontology and terminology']",['Ontology'],0.0,https://polcastellano.shinyapps.io/FOBI_Visualization_Tool/,https://bio.tools/fobi,378.0,215.0,312.79999999999995
circular gene ontology (cirgo),0.850,Visualises non-redundant two-level hierarchically structured ontology terms from gene expression data in a 2D space.,"['Ontology and terminology', 'Data visualisation', 'Gene expression']","['Command-line tool', 'Desktop application']",5.0,,https://bio.tools/circular gene ontology (cirgo),378.0,248.0,326.0
gopubmed,0.850,Tool that allows users to explore the results of PubMed queries in the context of Gene Ontology (GO) terms.,['Ontology and terminology'],['Web application'],321.0,,https://bio.tools/gopubmed,378.0,337.0,361.6
genease,0.850,"Real time bioinformatics tool for multi-omics and disease ontology exploration, analysis and visualization.","['Pathology', 'Ontology and terminology', 'Omics']",['Web application'],1.0,,https://bio.tools/genease,378.0,227.0,317.6
euadb,0.850,"EUAdb is database for COVID-19 test development that contains standardized information about Eemergency Use Authorizations-issued tests and is focused on RT-qPCR diagnostic tests, or high complexity molecular-based laboratory developed tests.","['Ontology and terminology', 'Probes and primers', 'PCR experiment', 'Sequencing']",['Database portal'],0.0,,https://bio.tools/euadb,378.0,215.0,312.79999999999995
neuroscience information framework,0.850,"A dynamic inventory of Web-based neuroscience resources: data, materials, and tools accessible via any computer connected to the Internet. An initiative of the NIH Blueprint for Neuroscience Research, the Neuroscience Information Framework advances neuroscience research by enabling discovery and access to public research data and tools worldwide through an open source, networked environment.","['Molecular interactions, pathways and networks', 'Ontology and terminology', 'Informatics', 'Neurobiology']",['Web application'],182.0,,https://bio.tools/neuroscience information framework,378.0,328.0,358.0
aber-owl,0.850,Framework for automatically accessing information that is annotated with ontologies or contains terms used to label classes in ontologies.,"['Ontology and terminology', 'Data submission, annotation and curation']",['Database portal'],37.0,,https://bio.tools/aber-owl,378.0,298.0,346.0
gene ontology,0.850,"The Gene Ontology resource.

Source ontology files for the Gene Ontology.

The Gene Ontology (GO) project is a major bioinformatics initiative to develop a computational representation of our evolving knowledge of how genes encode biological functions at the molecular, cellular and tissue system levels.","['Genetics', 'Molecular interactions, pathways and networks', 'Plant biology', 'Model organisms', 'Ontology and terminology']",['Web application'],0.0,http://geneontology.org/stats.html,https://bio.tools/gene ontology,378.0,215.0,312.79999999999995
seqexpress,0.850,"Comprehensive analysis and visualisation package for gene expression experiments. It is used to assign functional enrichment scores to clusters, using a combination of specially developed techniques and general statistical methods. These results can be explored using the in built ontology browsing tool or through the generated web pages.","['Ontology and terminology', 'Gene expression']",['Desktop application'],0.0,http://www.mybiosoftware.com/seqexpress-1-3-2-analysis-desktop-visualisation-program-gene-expression-experiments.html,https://bio.tools/seqexpress,378.0,215.0,312.79999999999995
bubastis,0.850,"An ontology change tool which is able to analyse two ontologies (typically two versions of the same ontology) to highlight logical changes which have occurred and to present these changes in more or less detail, as required.","['Data governance', 'Ontology and terminology', 'Natural language processing', 'Gene expression']",['Web application'],176.0,,https://bio.tools/bubastis,378.0,327.0,357.6
ontology lookup service,0.850,Repository for biomedical ontologies that aims to provide a single point of access to the latest ontology versions. Users can browse the ontologies through the web interface and programatic access is provided via a RESTful API.,['Ontology and terminology'],"['Web API', 'Web application']",257.0,https://github.com/EBISPOT/OLS/,https://bio.tools/ontology lookup service,378.0,332.0,359.6
the protein ontology,0.850,"It provides an ontological representation of protein-related entities by explicitly defining them and showing the relationships between them. Each PRO term represents a distinct class of entities (including specific modified forms, orthologous isoforms, and protein complexes) ranging from the taxon-neutral to the taxon-specific.","['Gene and protein families', 'Protein variants', 'Proteins', 'Model organisms', 'Ontology and terminology']",['Database portal'],76.0,,https://bio.tools/the protein ontology,378.0,311.0,351.2
sinopedia,0.850,"Linked Data Services platform for decentralized knowledge base | LodView is a powerful RDF viewer, IRI dereferencer and opensource SPARQL navigator | It is a long established fact that a reader will be distracted by the readable content of a page when looking at its layout. The point of using Lorem Ipsum is that it has a more-or-less normal distribution of letters, as opposed to using 'Content here, content here', making it look like readable English | Lorem Ipsum is simply dummy text of the printing and typesetting industry","['Ontology and terminology', 'Natural language processing', 'Machine learning']",[],0.0,,https://bio.tools/sinopedia,378.0,215.0,312.79999999999995
pyiomica,0.850,"Longitudinal Omics Analysis and Trend Identification.

This repository contains PyIOmica, a Python package that provides bioinformatics utilities for analyzing (dynamic) omics datasets. PyIOmica extends MathIOmica usage to Python and implements new visualizations and computational tools for graph analyses. The documentation is available at Read the Docs: https://pyiomica.readthedocs.io/en/latest/.

Welcome to PyIOmica’s documentation! — pyiomica 1.1.2 documentation.

Free document hosting provided by Read the Docs","['Molecular interactions, pathways and networks', 'Ontology and terminology', 'Bioinformatics']",[],0.0,,https://bio.tools/pyiomica,378.0,215.0,312.79999999999995
ramigo,0.850,"R interface sending requests to AmiGO visualize, retrieving DAG GO trees, parsing GraphViz DOT format files and exporting GML files for Cytoscape. Also uses RCytoscape to interactively display AmiGO trees in Cytoscape.",['Ontology and terminology'],"['Command-line tool', 'Library']",23.0,,https://bio.tools/ramigo,378.0,282.0,339.6
ufo,0.850,"A tool for unifying biomedical ontology-based semantic similarity calculation, enrichment analysis and visualization.","['Pathology', 'Protein interactions', 'Biomarkers', 'Genotype and phenotype', 'Ontology and terminology']",[],0.0,,https://bio.tools/ufo,378.0,215.0,312.79999999999995
bioportal,0.850,"BioPortal is a web accessible open repository of biomedical ontologies. Users may browse, search and visualize ontologies, as well as participate in the evaluation and evolution of ontology reviews by adding notes, corrections, reviews, etc. Data from other sources such as GEO, ClinicalTrials.gov and ArrayExpress may also be integrated with the ontologies.","['Mapping', 'Ontology and terminology', 'Medicine']",['Web application'],770.0,,https://bio.tools/bioportal,378.0,350.0,366.79999999999995
go-figure,0.850,"Summary Visualisations of Gene Ontology Terms with GO-Figure!.

GO-Figure! offers a simple solution for command-line plotting of informative summary visualisations of lists of GO terms, designed to support exploratory data analyses and multiple dataset comparisons.","['Genetics', 'Ontology and terminology', 'Evolutionary biology']",['Command-line tool'],0.0,,https://bio.tools/go-figure,378.0,215.0,312.79999999999995
plato plugin for autocomplete on ontologies,0.850,"General-use embeddable JavaScript widget used for browsing and searching ontologies. It is generically configurable for use with any ontology served by the Ontology Lookup Service (OLS). It’s features include the ability to visualise matching ontology terms in their rightful place in the tree, and to expand and collapse nodes as desired.","['Data management', 'Ontology and terminology']",['Web application'],48.0,,https://bio.tools/plato plugin for autocomplete on ontologies,378.0,304.0,348.4
odae,0.850,Ontology-based systematic representation and analysis of drug adverse events and its usage in study of adverse events given different patient age and disease conditions.,"['Ontology and terminology', 'Medicinal chemistry', 'Geriatric medicine']",['Ontology'],0.0,http://www.ontobee.org/ontology/ODAE,https://bio.tools/odae,378.0,215.0,312.79999999999995
plant experimental assay ontology (peao),0.500,"The Plant domain has been the subject of several attempts to structure and formally define terms and corresponding relations, such as their anatomical features, developmental stages, and the application of particular experimental procedures to a biological problem.  An ontology dedicated to the description of these experimental procedures, regardless of the scientific questions that prompted the assays. This ontology includes entities from three distinct realms (biological, physical and data), which include both experimental products, their relations and the protocols describing their manipulation.","['Plant biology', 'Ontology and terminology']",['Ontology'],0.0,https://bitbucket.org/PlantExpAssay/ontology/issues?status=new&status=open,https://bio.tools/plant experimental assay ontology (peao),339.0,215.0,289.4
list ontologies,0.500,This service returns the Ontologies registered on the NIF Ontoquest Server.,"['Data management', 'Ontology and terminology']",['Web API'],0.0,https://www.biocatalogue.org/services/2713,https://bio.tools/list ontologies,339.0,215.0,289.4
goa,0.500,"The UniProt GO annotation program aims to provide high-quality Gene Ontology (GO) annotations to proteins in the UniProt Knowledgebase (UniProtKB). The assignment of GO terms to UniProt records is an integral part of UniProt biocuration. UniProt manual and electronic GO annotations are supplemented with manual annotations supplied by external collaborating GO Consortium groups, to ensure a comprehensive GO annotation dataset is supplied to users.","['Model organisms', 'Ontology and terminology', 'Data submission, annotation and curation', 'Plant biology']",['Database portal'],198.0,,https://bio.tools/goa,339.0,329.0,335.0
spex2,0.500,"An automatic system for embryonic ISH image processing, which can extract, transform, compare, classify and cluster spatial gene expression patterns in Drosophila embryos.","['Genetics', 'Ontology and terminology', 'RNA', 'Gene expression']","['Command-line tool', 'Workflow']",28.0,http://www.mybiosoftware.com/spex2-automated-concise-extraction-spatial-gene-expression-patterns-fly-embryo-ish-image.html,https://bio.tools/spex2,339.0,289.0,319.0
clin-ik-links,0.500,"CLIN-IK-LINKS is a web-based platform that enables users to create, modify and delete mappings as well as to define and execute workflows. The CLIN-IK-LINKS platform allows the composition and execution of clinical data transformation workflows to convert EHR data into EHR and/or semantic web standards.","['Workflows', 'Mapping', 'Ontology and terminology']",['Web application'],0.0,,https://bio.tools/clin-ik-links,339.0,215.0,289.4
annot,0.500,"a Django-based sample, reagent, and experiment metadata tracking system.

Annot and information about what Annot is can be found here: https://gitlab.com/biotransistor/annot . This here is just tutorial material for the tutorial described here: http://annot.readthedocs.io/en/latest/man_tutorial.html .

Welcome to Annotamentum’s Documentation. — Annot 5 documentation.

Welcome to Annotamentum’s Documentation.¶.

Django admin based sample, reagent and experiment metadata tracking.

Summary: Annot is a web application, developed for biological wetlab experiment layout, sample and reagent logging, so that data is ready for sharing and analysis. On its core annot makes use of the acpipe_anjson library and acjson - assay coordinate json - file format. The use of controlled vocabulary from ontologies for sample and reagent annotation is enforced. Annot’s modular implementation can be adapted to a variety of experimental paradigms","['Data submission, annotation and curation', 'Proteomics', 'Microarray experiment', 'Ontology and terminology', 'Gene expression']",[],0.0,,https://bio.tools/annot,339.0,215.0,289.4
vsm,0.500,"General-purpose Interface for Biocuration and Knowledge Representation.

vsm-box is a web-component for entering and showing a VSM-sentence. – Explanation:.


For end-users: a vsm-box is an elegant and flexible interface for capturing structured information – and esp. easy when they can fill out VSM-template sentences.","['Systems biology', 'Literature and language', 'Machine learning', 'Model organisms', 'Ontology and terminology']",[],0.0,https://github.com/vsmjs/vsm-box,https://bio.tools/vsm,339.0,215.0,289.4
jprogo,0.500,Tool for the functional interpretation of prokaryotic microarray data using Gene Ontology information.,"['Model organisms', 'Ontology and terminology', 'Microarray experiment', 'Gene expression']",['Web application'],26.0,,https://bio.tools/jprogo,339.0,287.0,318.20000000000005
