name	description	type	topic	input	output
holovir	A robust and flexible data analysis pipeline that provides an optimised and validated workflow for taxonomic and functional characterisation of viral metagenomes.	['Command-line tool']	[{'term': 'Systems biology', 'uri': 'http://edamontology.org/topic_2259'}]	[{'data': {'term': 'sequence', 'uri': 'http://edamontology.org/data_2044'}}]	[{'data': {'term': 'sequence', 'uri': 'http://edamontology.org/data_2044'}}]
keggprofile	Annotation and visualization tool which integrated the expression profiles and the function annotation in KEGG pathway maps. The multi-types and multi-groups expression data can be visualized in one pathway map. It facilitated more detailed analysis about the specific function changes inner pathway or temporal correlations in different genes and samples.	['Command-line tool', 'Library']	[{'term': 'Molecular interactions, pathways and networks', 'uri': 'http://edamontology.org/topic_0602'}]	[]	[]
magecomet	An online tool that facilitates curation of MAGE-TAB. It combines text-mining and the Experimental Factor Ontology (EFO) to create a semi-automatic environment for faster annotation, guided data-manipulation and content summary.	['Web application']	[{'term': 'Data mining', 'uri': 'http://edamontology.org/topic_3473'}, {'term': 'Data architecture, analysis and design', 'uri': 'http://edamontology.org/topic_3365'}]	[]	[]
mucor	Software to aggregate variant information sourced from multiple VCF files (and some others, see below) into a variety of summary files with varying levels of detail and statistics.	['Command-line tool']	[{'term': 'Genetic variation', 'uri': 'http://edamontology.org/topic_0199'}, {'term': 'Statistics and probability', 'uri': 'http://edamontology.org/topic_2269'}, {'term': 'Genetics', 'uri': 'http://edamontology.org/topic_3053'}]	[]	[]
starpdb	A web-server for structural annotation of a protein based on its similarity with known protein structures.	['Web application']	[{'term': 'Proteins', 'uri': 'http://edamontology.org/topic_0078'}, {'term': 'Protein structure analysis', 'uri': 'http://edamontology.org/topic_2814'}, {'term': 'Protein folds and structural domains', 'uri': 'http://edamontology.org/topic_0736'}]	[]	[]
peakanalyzer	A set of utilities for the automated processing and annotation of genome-wide signal enrichment peaks derived through functional genomics techniques	['Suite']	[{'term': 'Functional genomics', 'uri': 'http://edamontology.org/topic_0085'}, {'term': 'Immunoprecipitation experiment', 'uri': 'http://edamontology.org/topic_3656'}, {'term': 'GWAS study', 'uri': 'http://edamontology.org/topic_3517'}]	[{'data': {'term': 'experiment report', 'uri': 'http://edamontology.org/data_2531'}, 'format': {'term': 'wig', 'uri': 'http://edamontology.org/format_3005'}}]	[{'data': {'term': 'experiment report', 'uri': 'http://edamontology.org/data_2531'}, 'format': {'term': 'wig', 'uri': 'http://edamontology.org/format_3005'}}]
mbrole	Server that performs functional enrichment analysis of a list of chemical compounds derived from a metabolomics experiment, which allows this list to be interpreted in biological terms.	['Web service']	[{'term': 'Molecular interactions, pathways and networks', 'uri': 'http://edamontology.org/topic_0602'}, {'term': 'Metabolomics', 'uri': 'http://edamontology.org/topic_3172'}]	[]	[]
pannotator	Automated pipeline for the annotation of closely related genomes well suited for pangenome studies.	['Web application']	[{'term': 'DNA', 'uri': 'http://edamontology.org/topic_0654'}, {'term': 'Sequencing', 'uri': 'http://edamontology.org/topic_3168'}, {'term': 'Microbiology', 'uri': 'http://edamontology.org/topic_3301'}, {'term': 'Genomics', 'uri': 'http://edamontology.org/topic_0622'}]	[]	[]
metdisease	App for Cytoscape, the bioinformatics network visualization tool. The app is used to annotate a metabolic network with MeSH disease terms, explore related diseases within a network, and link to PubMed references corresponding to any network node and selection of MeSH terms.	['Desktop application']	[{'term': 'Molecular interactions, pathways and networks', 'uri': 'http://edamontology.org/topic_0602'}, {'term': 'Data submission, annotation and curation', 'uri': 'http://edamontology.org/topic_0219'}, {'term': 'Endocrinology and metabolism', 'uri': 'http://edamontology.org/topic_3407'}, {'term': 'Pathology', 'uri': 'http://edamontology.org/topic_0634'}]	[]	[]
magi	Publicly available web application to explore and annotate cancer genomics data.	['Web application']	[{'term': 'Oncology', 'uri': 'http://edamontology.org/topic_2640'}, {'term': 'Genetics', 'uri': 'http://edamontology.org/topic_3053'}, {'term': 'Genomics', 'uri': 'http://edamontology.org/topic_0622'}]	[]	[]
npact	Computational and graphical representation tool for gene identification and sequence annotation. Identifies sequence segments of any length with statistically-significant 3-base compositional periodicities and associated with ORF structures .	['Command-line tool']	[{'term': 'DNA', 'uri': 'http://edamontology.org/topic_0654'}, {'term': 'Nucleic acid sites, features and motifs', 'uri': 'http://edamontology.org/topic_3511'}, {'term': 'Model organisms', 'uri': 'http://edamontology.org/topic_0621'}]	[]	[]
cogs	Collections of Clusters of Orthologous Genes provide indispensable tools for comparative genomic analysis, evolutionary reconstruction and functional annotation of new genomes.	['Web application']	[{'term': 'Proteins', 'uri': 'http://edamontology.org/topic_0078'}, {'term': 'DNA', 'uri': 'http://edamontology.org/topic_0654'}, {'term': 'Genomics', 'uri': 'http://edamontology.org/topic_0622'}, {'term': 'Evolutionary biology', 'uri': 'http://edamontology.org/topic_3299'}, {'term': 'Data submission, annotation and curation', 'uri': 'http://edamontology.org/topic_0219'}]	[]	[]
marky	It is able to annotate biomedical texts using different annotation classes. You only need a server with php technology and one database to annotate documents with a browser. Users can enter biomedical documents to be annotated by other users and get annotations for relevant terms, such as diseases, symptoms and treatments.	['Desktop application']	[{'term': 'Data submission, annotation and curation', 'uri': 'http://edamontology.org/topic_0219'}, {'term': 'Data management', 'uri': 'http://edamontology.org/topic_3071'}]	[]	[]
