name	description	type	topic	input	output
association viewer	AssociationViewer is a Java application used to display SNPs in a genetic context. Supplementary data (such as genes or LD plots) is downloaded from various public data sources on the fly and saved locally in a cache. Custom data can be added as supplementary tracks.	['Web application']	[{'term': 'Genomics', 'uri': 'http://edamontology.org/topic_0622'}]	[]	[]
openflu	The OpenFlu database (OpenFluDB) is part of a collaborative effort to share observations on the evolution of Influenza virus in both animals and humans. It contains genomic and protein sequences as well as epidemiological data from more than 25'000 isolates.	['Database portal']	[{'term': 'Genomics', 'uri': 'http://edamontology.org/topic_0622'}]	[]	[]
trifle	TRiFLe is a program for simulating TRFs and identifying species by TRF profiling	['Web application']	[{'term': 'Genomics', 'uri': 'http://edamontology.org/topic_0622'}, {'term': 'Population genetics', 'uri': 'http://edamontology.org/topic_3056'}]	[]	[]
estscan	ESTScan can detect coding regions (CDS) in DNA sequences, even if they are of low quality.  It  also detects/corrects sequencing errors that lead to frameshifts.  ESTScan is not a gene prediction program , nor is it an open reading frame detector.  In fact, its strength lies in the fact that it does not require an open reading frame to detect a coding region.  The program may miss a few translated amino acids at termini, but detects coding regions with high selectivity and sensitivity.	['Web application']	[{'term': 'Genomics', 'uri': 'http://edamontology.org/topic_0622'}, {'term': 'Transcriptomics', 'uri': 'http://edamontology.org/topic_3308'}]	[]	[]
mamot	C++ program for HMM models	['Web application']	[{'term': 'Sequence analysis', 'uri': 'http://edamontology.org/topic_0080'}, {'term': 'Genomics', 'uri': 'http://edamontology.org/topic_0622'}, {'term': 'Transcription factors and regulatory sites', 'uri': 'http://edamontology.org/topic_0749'}]	[]	[]
tromer	The transcriptome analyser project aims to provide tools to determine and document all the transcribed parts of a genome. The transcribed parts are defined by analysing experimental evidence, like expressed sequence tags (EST) and other mRNA sequences.	['Web application']	[{'term': 'Genomics', 'uri': 'http://edamontology.org/topic_0622'}, {'term': 'Transcriptomics', 'uri': 'http://edamontology.org/topic_3308'}]	[]	[]
myminer	MyMiner is a free and user-friendly text annotation tool aimed to assist in carrying out the main biocuration tasks and to provide labelled data for the development of text mining systems.	['Command-line tool']	[{'term': 'Biology', 'uri': 'http://edamontology.org/topic_3070'}, {'term': 'Data mining', 'uri': 'http://edamontology.org/topic_3473'}]	[]	[]
pannzer2	Protein ANNotation with Z-scoRE. Fully automated  functional annotation of prokaryotic and eukaryotic proteins of unknown function. Designed to predict the functional description (DE) and GO classes.	['Web application']	[{'term': 'Proteomics', 'uri': 'http://edamontology.org/topic_0121'}]	[{'data': {'term': 'text', 'uri': 'http://edamontology.org/data_3671'}, 'format': {'term': 'fasta-like (text)', 'uri': 'http://edamontology.org/format_2200'}}]	[{'data': {'term': 'text', 'uri': 'http://edamontology.org/data_3671'}, 'format': {'term': 'fasta-like (text)', 'uri': 'http://edamontology.org/format_2200'}}]
chemdistiller	Engine for metabolite annotation in mass spectrometry.	['Command-line tool']	[{'term': 'Mass spectrometry', 'uri': 'http://edamontology.org/topic_3520'}, {'term': 'Small molecules', 'uri': 'http://edamontology.org/topic_0154'}, {'term': 'Compound libraries and screening', 'uri': 'http://edamontology.org/topic_3343'}, {'term': 'Metabolomics', 'uri': 'http://edamontology.org/topic_3172'}]	[]	[]
lipid data analyzer (lda)	The tool enables lipid annotation in high-throughput data derived from chromatography-coupled tandem mass spectrometry.	['Command-line tool']	[{'term': 'Lipids', 'uri': 'http://edamontology.org/topic_0153'}, {'term': 'Metabolomics', 'uri': 'http://edamontology.org/topic_3172'}]	[{'data': {'term': 'mass spectrometry data', 'uri': 'http://edamontology.org/data_2536'}, 'format': {'term': 'mass spectrometry data format', 'uri': 'http://edamontology.org/format_3245'}}]	[{'data': {'term': 'mass spectrometry data', 'uri': 'http://edamontology.org/data_2536'}, 'format': {'term': 'mass spectrometry data format', 'uri': 'http://edamontology.org/format_3245'}}]
lobstahs	Multifunction package for screening, annotation, and putative identification of mass spectral features in large, HPLC-MS lipid datasets. In silico data for a wide range of lipids, oxidized lipids, and oxylipins can be generated from user-supplied structural criteria with a database generation function. It applies these databases to assign putative compound identities to features in any high-mass accuracy dataset that has been processed using xcms and CAMERA.	['Command-line tool', 'Library']	[{'term': 'Small molecules', 'uri': 'http://edamontology.org/topic_0154'}, {'term': 'Metabolomics', 'uri': 'http://edamontology.org/topic_3172'}]	[]	[]
openms	Open source library and a collection of tools and interfaces for the analysis of mass spectrometry data. Includes over 200 standalone (TOPP) tools that can be combined to a workflow with the integrated workflow editor TOPPAS. Raw and intermediate mass spectrometry data can be visualised with the included viewer TOPPView.	['Library', 'Workbench']	[{'term': 'Proteomics experiment', 'uri': 'http://edamontology.org/topic_3520'}, {'term': 'Proteomics', 'uri': 'http://edamontology.org/topic_0121'}, {'term': 'Metabolomics', 'uri': 'http://edamontology.org/topic_3172'}]	[{'data': {'term': 'peptide identification', 'uri': 'http://edamontology.org/data_0945'}, 'format': {'term': 'qcml', 'uri': 'http://edamontology.org/format_3683'}}]	[{'data': {'term': 'peptide identification', 'uri': 'http://edamontology.org/data_0945'}, 'format': {'term': 'qcml', 'uri': 'http://edamontology.org/format_3683'}}]
openms	Open source library and a collection of tools and interfaces for the analysis of mass spectrometry data. Includes over 200 standalone (TOPP) tools that can be combined to a workflow with the integrated workflow editor TOPPAS. Raw and intermediate mass spectrometry data can be visualised with the included viewer TOPPView.	['Library', 'Workbench']	[{'term': 'Proteomics experiment', 'uri': 'http://edamontology.org/topic_3520'}, {'term': 'Proteomics', 'uri': 'http://edamontology.org/topic_0121'}, {'term': 'Metabolomics', 'uri': 'http://edamontology.org/topic_3172'}]	[{'data': {'term': 'peptide identification', 'uri': 'http://edamontology.org/data_0945'}, 'format': {'term': 'qcml', 'uri': 'http://edamontology.org/format_3683'}}]	[{'data': {'term': 'peptide identification', 'uri': 'http://edamontology.org/data_0945'}, 'format': {'term': 'qcml', 'uri': 'http://edamontology.org/format_3683'}}]
histone coder	Count the number of MS/MS ions in a given spectrum to determine the unambiguous localization of a post-translational modification (PTM). The software lists number and type of site determining ions found between the assigned PTM localization by Mascot (Matrix Science) and the closest other amino acids which can host the modification. The PTMs included in the script are phosphorylation (S,T,Y), acetylation (K), mono- and dimethylation (K,R) and trimethylation (K).	['Desktop application']	[{'term': 'Protein modifications', 'uri': 'http://edamontology.org/topic_0601'}, {'term': 'Epigenetics', 'uri': 'http://edamontology.org/topic_3295'}, {'term': 'Proteomics experiment', 'uri': 'http://edamontology.org/topic_3520'}]	[{'data': {'term': 'sequence search results', 'uri': 'http://edamontology.org/data_0857'}, 'format': {'term': 'xml', 'uri': 'http://edamontology.org/format_2332'}}]	[{'data': {'term': 'sequence search results', 'uri': 'http://edamontology.org/data_0857'}, 'format': {'term': 'xml', 'uri': 'http://edamontology.org/format_2332'}}]
cdfread	A simple reader of mass spectra in netCDF.	['Command-line tool']	[{'term': 'Proteomics experiment', 'uri': 'http://edamontology.org/topic_3520'}]	[{'data': {'term': 'mass spectrometry spectra', 'uri': 'http://edamontology.org/data_0943'}, 'format': {'term': 'netcdf', 'uri': 'http://edamontology.org/format_3650'}}]	[{'data': {'term': 'mass spectrometry spectra', 'uri': 'http://edamontology.org/data_0943'}, 'format': {'term': 'netcdf', 'uri': 'http://edamontology.org/format_3650'}}]
microtss	microTSS is a machine-learning algorithm that provides highly accurate, single-nucleotide resolution predictions for intergenic miRNA transcription start sites (TSSs). MicroTSS integrates high-resolution RNA-sequencing data with active transcription marks derived from chromatin immunoprecipitation and DNase-sequencing to enable the characterization of tissue-specific promoters	['Command-line tool']	[{'term': 'Sequencing', 'uri': 'http://edamontology.org/topic_3168'}, {'term': 'Machine learning', 'uri': 'http://edamontology.org/topic_3474'}]	[]	[]
diana-mirgen	Provides accurate cell-line-specific miRNA gene transcription start sites, coupled with genome-wide maps of transcription factor binding sites in order to unveil the mechanisms of miRNA transcription regulation. The database schema and web interface facilitates user interaction, provides advanced queries and innate connection with other DIANA resources for miRNA target identification and pathway analysis.	['Web application']	[{'term': 'Gene structure', 'uri': 'http://edamontology.org/topic_0114'}, {'term': 'Gene expression', 'uri': 'http://edamontology.org/topic_0203'}]	[]	[]
diana-lncbase	Incorporates an extensive collection of miRNA:lncRNA interactions. The database includes more than 70,000 low and high-throughput, (in)direct miRNA:lncRNA experimentally supported interactions, derived from manually curated publications and the analysis of 153 AGO CLIP-Seq libraries. LncBase v2 hosts in silico predicted miRNA targets on lncRNAs, identified with the DIANA-microT algorithm.	['Web application']	[{'term': 'Gene regulation', 'uri': 'http://edamontology.org/topic_0204'}]	[]	[]
biomodels database	Database of annotated published models is a data resource that allows biologists to store, search and retrieve published mathematical models of biological interests. Models present in this database are annotated and linked to relevant data resources, such as publications, databases of compounds and controlled vocabularies, and this modelling formats can be converted, with some of them being available online to be used directly.	['Database portal']	[{'term': 'Molecular interactions, pathways and networks', 'uri': 'http://edamontology.org/topic_0602'}, {'term': 'Systems biology', 'uri': 'http://edamontology.org/topic_2259'}]	[{'data': {'term': 'mathematical model', 'uri': 'http://edamontology.org/data_0950'}, 'format': {'term': 'sbml', 'uri': 'http://edamontology.org/format_2585'}}]	[{'data': {'term': 'mathematical model', 'uri': 'http://edamontology.org/data_0950'}, 'format': {'term': 'sbml', 'uri': 'http://edamontology.org/format_2585'}}]
meme suite	Unified portal for discovery and analysis of sequence motifs (e.g. DNA binding sites, protein interaction domains). Motifs with/without gaps may be discovered, searched for in DNA and protein databases, compared to other motifs and analyzed for putative function by association with gene ontology terms. MEME is a tool designed for discovering and searching for DNA motifs such as transcription factor binding sites (TFBS) or protein domains.	['Command-line tool', 'Web application', 'Suite']	[{'term': 'Transcription factors and regulatory sites', 'uri': 'http://edamontology.org/topic_0749'}, {'term': 'Gene expression', 'uri': 'http://edamontology.org/topic_0203'}, {'term': 'DNA binding sites', 'uri': 'http://edamontology.org/topic_3125'}, {'term': 'Protein folds and structural domains', 'uri': 'http://edamontology.org/topic_0736'}, {'term': 'Sequence sites, features and motifs', 'uri': 'http://edamontology.org/topic_0160'}]	[{'data': {'term': 'sequence', 'uri': 'http://edamontology.org/data_2044'}, 'format': {'term': 'fasta', 'uri': 'http://edamontology.org/format_1929'}}]	[{'data': {'term': 'sequence', 'uri': 'http://edamontology.org/data_2044'}, 'format': {'term': 'fasta', 'uri': 'http://edamontology.org/format_1929'}}]
meme suite	Unified portal for discovery and analysis of sequence motifs (e.g. DNA binding sites, protein interaction domains). Motifs with/without gaps may be discovered, searched for in DNA and protein databases, compared to other motifs and analyzed for putative function by association with gene ontology terms. MEME is a tool designed for discovering and searching for DNA motifs such as transcription factor binding sites (TFBS) or protein domains.	['Command-line tool', 'Web application', 'Suite']	[{'term': 'Transcription factors and regulatory sites', 'uri': 'http://edamontology.org/topic_0749'}, {'term': 'Gene expression', 'uri': 'http://edamontology.org/topic_0203'}, {'term': 'DNA binding sites', 'uri': 'http://edamontology.org/topic_3125'}, {'term': 'Protein folds and structural domains', 'uri': 'http://edamontology.org/topic_0736'}, {'term': 'Sequence sites, features and motifs', 'uri': 'http://edamontology.org/topic_0160'}]	[{'data': {'term': 'sequence', 'uri': 'http://edamontology.org/data_2044'}, 'format': {'term': 'fasta', 'uri': 'http://edamontology.org/format_1929'}}]	[{'data': {'term': 'sequence', 'uri': 'http://edamontology.org/data_2044'}, 'format': {'term': 'fasta', 'uri': 'http://edamontology.org/format_1929'}}]
cpgavas	CPGAVAS (Chloroplast Genome Annotation, Visualization, Analysis, and GenBank Submission) is a web server which allows accurate genome annotation, the generation of circular chloroplast genome maps, the provision of useful analysis results of the annotated genome, the creation of files that can be submitted to GenBank directly.	['Command-line tool']	[{'term': 'DNA', 'uri': 'http://edamontology.org/topic_0654'}]	[]	[]
rdavidwebservice	Tool for retrieving data from DAVID database that offers the main functionalities of the website, including a connectivity to upload gene background lists, or the reports of the submitted information.	['Command-line tool', 'Library']	[{'term': 'Data acquisition', 'uri': 'http://edamontology.org/topic_3077'}]	[]	[]
diana-microt v5.0	"Dedicated to miRNA target prediction and functional analysis and is widely used since 2009 from the scientific community. 
It predicts targets for miRNAs and provides functional information on the predicted miRNA:target gene interaction from various online biological resources. Updates enable the association of miRNAs to diseases through bibliographic analysis and connection to the UCSC genome browser. Updates include sophisticated workflows."	['Web application']	[{'term': 'Functional, regulatory and non-coding RNA', 'uri': 'http://edamontology.org/topic_0659'}, {'term': 'Molecular interactions, pathways and networks', 'uri': 'http://edamontology.org/topic_0602'}, {'term': 'Small molecules', 'uri': 'http://edamontology.org/topic_0154'}, {'term': 'Pathology', 'uri': 'http://edamontology.org/topic_0634'}, {'term': 'Gene transcripts', 'uri': 'http://edamontology.org/topic_3512'}, {'term': 'Bioinformatics', 'uri': 'http://edamontology.org/topic_0091'}]	[]	[]
gwastools	Classes for storing very large GWAS data sets and annotation, and functions for GWAS data cleaning and analysis.	['Command-line tool', 'Library']	[{'term': 'GWAS study', 'uri': 'http://edamontology.org/topic_3517'}]	[]	[]
zooma	ZOOMA 2 is a search engine for automatic curation and a repository of annotation knowledge. It facilitates automated data annotation against a variety of ontologies by exploring context and previous annotation efforts as well as lexical matching	['Web application']	[{'term': 'Ontology and terminology', 'uri': 'http://edamontology.org/topic_0089'}, {'term': 'Systems biology', 'uri': 'http://edamontology.org/topic_2259'}, {'term': 'Data identity and mapping', 'uri': 'http://edamontology.org/topic_3345'}]	[{'data': {'term': 'keyword', 'uri': 'http://edamontology.org/data_0968'}}]	[{'data': {'term': 'keyword', 'uri': 'http://edamontology.org/data_0968'}}]
dictybase update 2011	Database for the biology and genomics of the social amoeba Dictyostelium discoideum. It provides well integrated, high quality data and tools for Dictyostelium discoideum and related species. It houses the complete genome sequence, ESTs, and the entire body of literature relevant to Dictyostelium. This information is curated to provide accurate gene models and functional annotations, with the goal of fully annotating the genome to provide a reference genome in the Amoebozoa clade.	['Database portal']	[{'term': 'Gene transcripts', 'uri': 'http://edamontology.org/topic_3512'}, {'term': 'Model organisms', 'uri': 'http://edamontology.org/topic_0621'}, {'term': 'Database management', 'uri': 'http://edamontology.org/topic_3489'}, {'term': 'Genomics', 'uri': 'http://edamontology.org/topic_0622'}, {'term': 'Sequencing', 'uri': 'http://edamontology.org/topic_3168'}]	[{'data': {'term': 'gene id', 'uri': 'http://edamontology.org/data_2295'}}]	[{'data': {'term': 'gene id', 'uri': 'http://edamontology.org/data_2295'}}]
funcexplorer	A web tool for automated hierarchical clustering and enrichment analysis of high-throughput genomics data with interactive visualizations of the results. It enables to obtain a first interactive overview of expression patterns, gene names and shared functionalities in the dataset.	['Web application']	[{'term': 'Functional genomics', 'uri': 'http://edamontology.org/topic_0085'}, {'term': 'Gene expression', 'uri': 'http://edamontology.org/topic_0203'}, {'term': 'RNA-seq', 'uri': 'http://edamontology.org/topic_3170'}, {'term': 'Microarray experiment', 'uri': 'http://edamontology.org/topic_3518'}]	[{'data': {'term': 'gene expression data', 'uri': 'http://edamontology.org/data_2603'}, 'format': {'term': 'dsv', 'uri': 'http://edamontology.org/format_3751'}}]	[{'data': {'term': 'gene expression data', 'uri': 'http://edamontology.org/data_2603'}, 'format': {'term': 'dsv', 'uri': 'http://edamontology.org/format_3751'}}]
copheism	Simulate phenotypes: continuous, dichotomous and survival for common variants from existing genotype data simulated with some other tool. Add the phenotype to generated genotype data prepared with a genetic simulator. The output of cophesim can be used as a direct input for different genome wide association study tools.	['Command-line tool', 'Script']	[{'term': 'Simulation experiment', 'uri': 'http://edamontology.org/topic_3524'}, {'term': 'Phenomics', 'uri': 'http://edamontology.org/topic_3298'}]	[]	[]
odg	Tool for generating, querying, and analyzing multi-omics comparative databases to facilitate biological understanding.	['Command-line tool']	[{'term': 'Comparative genomics', 'uri': 'http://edamontology.org/topic_0797'}, {'term': 'Data integration and warehousing', 'uri': 'http://edamontology.org/topic_3366'}]	[]	[]
clinotator	Takes variants as input and queries NCBI eutilities to generate ClinVar Variation Report scoring metrics. The overall goal is to generate annotations of use for given batches of variants to inform clinical interpretation. The metrics include: Clinotator Raw Score, Average Clinical Assertion Age, Clinotator Predicted Significance and eclassification Recommendation.	['Command-line tool']	[{'term': 'Genetic variation', 'uri': 'http://edamontology.org/topic_0199'}, {'term': 'Medical informatics', 'uri': 'http://edamontology.org/topic_3063'}]	[{'data': {'term': 'report', 'uri': 'http://edamontology.org/data_2048'}, 'format': {'term': 'textual format', 'uri': 'http://edamontology.org/format_2330'}}]	[{'data': {'term': 'report', 'uri': 'http://edamontology.org/data_2048'}, 'format': {'term': 'textual format', 'uri': 'http://edamontology.org/format_2330'}}]
sevenc	Chromatin looping is an essential feature of eukaryotic genomes and can bring regulatory sequences, such as enhancers or transcription factor binding sites, in the close physical proximity of regulated target genes. This package uses protein binding signals from ChIP-seq and sequence motif information to predict chromatin looping events.	['Library']	[{'term': 'ChIP-seq', 'uri': 'http://edamontology.org/topic_3169'}, {'term': 'ChIP-on-chip', 'uri': 'http://edamontology.org/topic_3179'}, {'term': 'Epigenetics', 'uri': 'http://edamontology.org/topic_3295'}, {'term': 'Functional genomics', 'uri': 'http://edamontology.org/topic_0085'}]	[]	[]
cellbaser	This package makes use of the exhaustive RESTful Web service API that has been implemented for the Cellabase database. It enable researchers to query and obtain a wealth of biological information from a single database saving a lot of time. Another benefit is that researchers can easily make queries about different biological topics and link all this information together as all information is integrated.	['Library']	[{'term': 'Database management', 'uri': 'http://edamontology.org/topic_3489'}]	[]	[]
cagefightr	It is an R/Bioconductor package for performing a wide range of common CAGE data analysis tasks. Core functionality includes: import of CAGE TSSs (CTSSs), tag (or unidirectional) clustering for TSS identification, bidirectional clustering for enhancer identification, annotation with transcript and gene models, calculation of TSS shapes and quantification of CAGE expression as expression matrices.	['Library']	[{'term': 'Gene expression', 'uri': 'http://edamontology.org/topic_0203'}, {'term': 'Gene regulation', 'uri': 'http://edamontology.org/topic_0204'}, {'term': 'Sequencing', 'uri': 'http://edamontology.org/topic_3168'}, {'term': 'Transcriptomics', 'uri': 'http://edamontology.org/topic_3308'}]	[]	[]
gofuncr	It performs a gene ontology enrichment analysis based on the ontology enrichment software FUNC. GO-annotations are obtained from OrganismDb or OrgDb packages; the GO-graph is included in the package and updated regularly. GOfuncR provides the standard candidate vs. background enrichment analysis using the hypergeometric test, as well as three additional tests.	['Library']	[{'term': 'Ontology and terminology', 'uri': 'http://edamontology.org/topic_0089'}]	[]	[]
genomicscores	Provide infrastructure to store and access genomewide position-specific scores within R and Bioconductor.	['Library']	[{'term': 'Genetics', 'uri': 'http://edamontology.org/topic_3053'}, {'term': 'Sequencing', 'uri': 'http://edamontology.org/topic_3168'}]	[]	[]
qtl tableminer++(qtm)	It is a command-line tool to retrieve and semantically annotate results obtained from QTL mapping experiments. It takes full-text articles from the Europe PMC repository as input and outputs the extracted QTLs into a relational database (SQLite) and text file (CSV).	['Command-line tool']	[{'term': 'Ontology and terminology', 'uri': 'http://edamontology.org/topic_0089'}]	[]	[]
samsa2	"Version 2 of the SAMSA pipeline - faster! Lighter! More options! Less waiting!
It is a rapid and efficient metatranscriptome pipeline for analyzing large RNA-seq datasets in a supercomputing cluster environment. It provides simplified output that can be examined directly or used for further analyses, and its reference databases may be upgraded, altered or customized to fit the needs of any experiment."	['Workflow']	[{'term': 'Metatranscriptomics', 'uri': 'http://edamontology.org/topic_3308'}, {'term': 'Metagenomics', 'uri': 'http://edamontology.org/topic_3174'}, {'term': 'RNA-seq', 'uri': 'http://edamontology.org/topic_3170'}, {'term': 'Microbiome', 'uri': 'http://edamontology.org/topic_3697'}]	[]	[]
onesense	A graphical user interface that facilitates the dimensional reduction method based on the t-distributed stochastic neighbor embedding (t-SNE) algorithm, for categorical analysis of mass cytometry data.	['Library']	[{'term': 'Biology', 'uri': 'http://edamontology.org/topic_3070'}]	[]	[]
chimera	This package facilitates the characterisation of fusion products events. It allows to import fusion data results from the following fusion finders: chimeraScan, bellerophontes, deFuse, FusionFinder, FusionHunter, mapSplice, tophat-fusion, FusionMap, STAR, Rsubread, fusionCatcher.	['Library']	[{'term': 'Gene structure', 'uri': 'http://edamontology.org/topic_0114'}]	[]	[]
omadb	A package for the orthology prediction data download from OMA database.	['Library']	[{'term': 'Comparative genomics', 'uri': 'http://edamontology.org/topic_0797'}, {'term': 'Functional genomics', 'uri': 'http://edamontology.org/topic_0085'}, {'term': 'Function analysis', 'uri': 'http://edamontology.org/topic_1775'}, {'term': 'Genetics', 'uri': 'http://edamontology.org/topic_3053'}]	[]	[]
organism.dplyr	This package provides an alternative interface to Bioconductor 'annotation' resources, in particular the gene identifier mapping functionality of the 'org' packages (e.g., org.Hs.eg.db) and the genome coordinate functionality of the 'TxDb' packages	['Library']	[{'term': 'Sequencing', 'uri': 'http://edamontology.org/topic_3168'}]	[]	[]
roma	A package for the orthology prediction data download from OMA database.	['Library']	[{'term': 'Comparative genomics', 'uri': 'http://edamontology.org/topic_0797'}, {'term': 'Functional genomics', 'uri': 'http://edamontology.org/topic_0085'}, {'term': 'Genetics', 'uri': 'http://edamontology.org/topic_3053'}]	[]	[]
gdsarray	GDS files are widely used to represent genotyping or sequence data. The GDSArray package implements the `GDSArray` class to represent nodes in GDS files in a matrix-like representation that allows easy manipulation (e.g., subsetting, mathematical transformation) in _R_. The data remains on disk until needed, so that very large files can be processed.	['Library']	[{'term': 'Sequencing', 'uri': 'http://edamontology.org/topic_3168'}]	[]	[]
