name	description	type	topic	input	output
treeio	Base classes and functions for parsing and exporting phylogenetic trees. This package supports parsing analysis findings from commonly used software packages, allows linking external data to phylogeny and merging tree data obtained from different sources. It also supports exporting phylogenetic tree with heterogeneous associated data to a single tree file.	['Library']	[{'term': 'Phylogenetics', 'uri': 'http://edamontology.org/topic_3293'}]	[]	[]
workflow4metabolomics	First fully open-source and collaborative online platform for computational metabolomics. It includes preprocessing, normalization, quality control, statistical analysis of LC/MS, FIA-MS, GC/MS and NMR data.	['Bioinformatics portal']	[{'term': 'Systems biology', 'uri': 'http://edamontology.org/topic_2259'}, {'term': 'Metabolomics', 'uri': 'http://edamontology.org/topic_3172'}, {'term': 'Computational biology', 'uri': 'http://edamontology.org/topic_3307'}]	[{'data': {'term': 'mass spectrum', 'uri': 'http://edamontology.org/data_0943'}, 'format': {'term': 'mzml', 'uri': 'http://edamontology.org/format_3244'}}]	[{'data': {'term': 'mass spectrum', 'uri': 'http://edamontology.org/data_0943'}, 'format': {'term': 'mzml', 'uri': 'http://edamontology.org/format_3244'}}]
globalfungi	"User interface to data from high-throughput sequencing studies of fungal
communities across terrestrial biomes. Includes sequencing data, sample
locations, sample metadata."	['Database portal']	[{'term': 'Agricultural science', 'uri': 'http://edamontology.org/topic_3810'}, {'term': 'Biodiversity', 'uri': 'http://edamontology.org/topic_3050'}]	[{'data': {'term': 'nucleic acid sequence', 'uri': 'http://edamontology.org/data_2977'}, 'format': {'term': 'fasta', 'uri': 'http://edamontology.org/format_1929'}}]	[{'data': {'term': 'nucleic acid sequence', 'uri': 'http://edamontology.org/data_2977'}, 'format': {'term': 'fasta', 'uri': 'http://edamontology.org/format_1929'}}]
amtdb	This is the place where you can find an updated list of the published mitochondrial sequences coming from the ancient DNA samples (aDNA). The main interest of our database lies in the anatomically modern Homo sapiens samples, ranging from the late Paleolithic to roughly Iron Age times, focusing on an Euroasian geographical area. We provide both the mtDNA sequences (in FASTA format), and the metadata for the samples (IDs, dates, geolocation, site, culture, mtDNA haplogroup etc., available to download in a tab-delimited text file).	['Database portal']	[{'term': 'Biology', 'uri': 'http://edamontology.org/topic_3070'}]	[{'data': {'term': 'nucleic acid sequence', 'uri': 'http://edamontology.org/data_2977'}, 'format': {'term': 'textual format', 'uri': 'http://edamontology.org/format_2330'}}]	[{'data': {'term': 'nucleic acid sequence', 'uri': 'http://edamontology.org/data_2977'}, 'format': {'term': 'textual format', 'uri': 'http://edamontology.org/format_2330'}}]
causalbuilder	The causalBuilder is a prototype web application for the curation of molecular interaction causal statements. This interface takes advantage of the VSM framework (https://github.com/vsmjs/) to generate customized VSM-templates for the annotation of specific causal statements. The causal statements generated are compatible with the MI2CAST (Minimum Information about a Molecular Interaction Causal Statement) checklist that is available at https://github.com/MI2CAST/MI2CAST.	['Web application']	[{'term': 'Molecular interactions, pathways and networks', 'uri': 'http://edamontology.org/topic_0602'}]	[{'data': {'term': 'text', 'uri': 'http://edamontology.org/data_3671'}}]	[{'data': {'term': 'text', 'uri': 'http://edamontology.org/data_3671'}}]
metfamily	Web application designed for the identification of regulated metabolite families. This is possible on the basis of metabolite profiles for a set of MS¹ features as well as one MS/MS spectrum for each MS¹ feature. Group-discriminating MS¹ features are identified using a PCA of metabolite profiles and metabolite families are identified using a HCA of MS/MS spectra. Regulated metabolite families are identified by considering group-discriminating MS¹ features from corporate metabolite families.	['Web application']	[{'term': 'Metabolomics', 'uri': 'http://edamontology.org/topic_3172'}]	[{'data': {'term': 'mass spectrometry spectra', 'uri': 'http://edamontology.org/data_0943'}, 'format': {'term': 'textual format', 'uri': 'http://edamontology.org/format_2330'}}]	[{'data': {'term': 'mass spectrometry spectra', 'uri': 'http://edamontology.org/data_0943'}, 'format': {'term': 'textual format', 'uri': 'http://edamontology.org/format_2330'}}]
fairdatapoint	FAIRDataPoint is a REST api for creating, storing and servering FAIR metadata. The metadata contents are in this api are generated semi-automatically according to the FAIR Data Point software specification document. In the current version of api we support GET, POST and PATCH requests.	['Web API', 'Web application']	[{'term': 'Informatics', 'uri': 'http://edamontology.org/topic_0605'}, {'term': 'Ontology and terminology', 'uri': 'http://edamontology.org/topic_0089'}]	[{'data': {'term': 'text data', 'uri': 'http://edamontology.org/data_2526'}, 'format': {'term': 'n-triples', 'uri': 'http://edamontology.org/format_3256'}}]	[{'data': {'term': 'text data', 'uri': 'http://edamontology.org/data_2526'}, 'format': {'term': 'n-triples', 'uri': 'http://edamontology.org/format_3256'}}]
ciona robusta anatomy and development ontology	The first ontology describing the anatomy and the development of Ciona robusta, based on the Hotta developmental table.	['Ontology']	[{'term': 'Developmental biology', 'uri': 'http://edamontology.org/topic_3064'}]	[{'data': {'term': 'bibliography', 'uri': 'http://edamontology.org/data_3505'}, 'format': {'term': 'textual format', 'uri': 'http://edamontology.org/format_2330'}}]	[{'data': {'term': 'bibliography', 'uri': 'http://edamontology.org/data_3505'}, 'format': {'term': 'textual format', 'uri': 'http://edamontology.org/format_2330'}}]
faf-drugs	Process compound collections via simple absorption, distribution, metabolism, excretion and toxicity (ADME/tox) filtering rules to aid in the drug discovery process.	['Web application']	[{'term': 'Drug discovery', 'uri': 'http://edamontology.org/topic_3336'}]	[{'data': {'term': 'small molecule structure', 'uri': 'http://edamontology.org/data_1463'}, 'format': {'term': 'sdf', 'uri': 'http://edamontology.org/format_3814'}}]	[{'data': {'term': 'small molecule structure', 'uri': 'http://edamontology.org/data_1463'}, 'format': {'term': 'sdf', 'uri': 'http://edamontology.org/format_3814'}}]
secstrannotator	Annotation of secondary structure elements in proteins.	['Web API']	[{'term': 'Structural biology', 'uri': 'http://edamontology.org/topic_1317'}]	[{'data': {'term': 'protein structure', 'uri': 'http://edamontology.org/data_1460'}, 'format': {'term': 'pdb database entry format', 'uri': 'http://edamontology.org/format_1475'}}]	[{'data': {'term': 'protein structure', 'uri': 'http://edamontology.org/data_1460'}, 'format': {'term': 'pdb database entry format', 'uri': 'http://edamontology.org/format_1475'}}]
python video annotator	PythonVideoAnnotator is a graphical application written in Python, to analyze and create notes for events in videos. It was developed with the aim of helping neuroscience and ethology researchers to identify animals’ behaviors based on the information extracted from the video.	['Desktop application']	[{'term': 'Data visualisation', 'uri': 'http://edamontology.org/topic_0092'}]	[]	[]
annotsv	Integrated tool for annotation and ranking of structural variations.	['Command-line tool', 'Web application']	[{'term': 'DNA structural variation', 'uri': 'http://edamontology.org/topic_3175'}, {'term': 'Bioinformatics', 'uri': 'http://edamontology.org/topic_0091'}, {'term': 'Sequencing', 'uri': 'http://edamontology.org/topic_3168'}, {'term': 'Genetics', 'uri': 'http://edamontology.org/topic_3053'}, {'term': 'Genetic variation', 'uri': 'http://edamontology.org/topic_0199'}]	[]	[]
annotsv	Integrated tool for annotation and ranking of structural variations.	['Command-line tool', 'Web application']	[{'term': 'DNA structural variation', 'uri': 'http://edamontology.org/topic_3175'}, {'term': 'Bioinformatics', 'uri': 'http://edamontology.org/topic_0091'}, {'term': 'Sequencing', 'uri': 'http://edamontology.org/topic_3168'}, {'term': 'Genetics', 'uri': 'http://edamontology.org/topic_3053'}, {'term': 'Genetic variation', 'uri': 'http://edamontology.org/topic_0199'}]	[]	[]
ceu mass mediator	Tool for looking up metabolites in different databases (Kegg, HMDB, LipidMaps, Metlin and MINE) from experimental masses obtained by mass spectrometry.	['Web application']	[{'term': 'Metabolomics', 'uri': 'http://edamontology.org/topic_3172'}]	[{'data': {'term': 'mass spectrometry spectra', 'uri': 'http://edamontology.org/data_0943'}, 'format': {'term': 'textual format', 'uri': 'http://edamontology.org/format_2330'}}]	[{'data': {'term': 'mass spectrometry spectra', 'uri': 'http://edamontology.org/data_0943'}, 'format': {'term': 'textual format', 'uri': 'http://edamontology.org/format_2330'}}]
do	The Disease Ontology (DO) has been developed as a standardized ontology for human disease with the purpose of providing the biomedical community with consistent, reusable and sustainable descriptions of human disease terms, phenotype characteristics and related medical vocabulary disease concepts.	['Web application', 'Database portal']	[{'term': 'Pathology', 'uri': 'http://edamontology.org/topic_0634'}, {'term': 'Ontology and terminology', 'uri': 'http://edamontology.org/topic_0089'}, {'term': 'Medical informatics', 'uri': 'http://edamontology.org/topic_3063'}, {'term': 'Molecular interactions, pathways and networks', 'uri': 'http://edamontology.org/topic_0602'}, {'term': 'Rare diseases', 'uri': 'http://edamontology.org/topic_3325'}]	[]	[]
diversityreferences	DiversityReferences (DWB-DR) is an application of Diversity Workbench (DWB). It might be installed as part of a DWB environment, but also as a stand-alone application, e. g., in a local installation. Each DWB module is devoted to a specific data domain. DR is focussed on the management of bibliographic data about each kind of scientific publications. The tool is handling literature annotations, abstracts, keywords and any kind of descriptors and publication object identifiers. DR is able to import and export literature citations and is used to organise documents and multimedia resources.	['Desktop application']	[{'term': 'Biology', 'uri': 'http://edamontology.org/topic_3070'}, {'term': 'Data management', 'uri': 'http://edamontology.org/topic_3071'}, {'term': 'Literature and language', 'uri': 'http://edamontology.org/topic_3068'}]	[{'data': {'term': 'text data', 'uri': 'http://edamontology.org/data_2526'}, 'format': {'term': 'textual format', 'uri': 'http://edamontology.org/format_2330'}}]	[{'data': {'term': 'text data', 'uri': 'http://edamontology.org/data_2526'}, 'format': {'term': 'textual format', 'uri': 'http://edamontology.org/format_2330'}}]
diversity workbench	The modularized Diversity Workbench (=DWB) represents a tool suite for the management of life and environmental sciences data. The DWB is handling different kinds of bio- and geodiversity data, taxonomies, terminologies, and facilitates the processing of ecological, molecular biological, observational, collection and taxonomic data. It is capable and flexible enough to be applied as data storage system for institutional data repositories. The DWB is set up on a system of 11 xml-enabled SQL relational databases. The rich clients are installed as desktop applications. The DWB might be run as an intranet solution and provide direct interoperability with clients of interlinked DWB databases including cloud services. DWB installations are flexible in the management of highly structured data, enable sophisticated user administration and allow for user-adapted data entry and data exchange. Further, the DWB design facilitates the dynamic integration of web services and external data resources.	['Workbench']	[{'term': 'Biology', 'uri': 'http://edamontology.org/topic_3070'}, {'term': 'Environmental science', 'uri': 'http://edamontology.org/topic_3855'}, {'term': 'Experimental design and studies', 'uri': 'http://edamontology.org/topic_3678'}, {'term': 'Omics', 'uri': 'http://edamontology.org/topic_3391'}, {'term': 'Literature and language', 'uri': 'http://edamontology.org/topic_3068'}, {'term': 'Data management', 'uri': 'http://edamontology.org/topic_3071'}, {'term': 'Ontology and terminology', 'uri': 'http://edamontology.org/topic_0089'}]	[]	[]
diversitycollection	DiversityCollection (DWB-DC) is an application of the Diversity Workbench (DWB). It might be installed as part of a DWB environment, but also as a stand-alone application, e. g., in a local installation. Each DWB module is devoted to a specific data domain. DC is designed for data describing collection events, collections, collection vouchers and specimens, parts of specimens, as well as observation and occurrence data with assigned multimedia objects and documents. It is processing any action concerning the gathering, storage, transaction and treatment of specimens in a collection and is also appropriate to store observation data with analyses added. DC is unique among  collection management systems by its focus on biological relations between organisms linked together as one or more specimens or observations (e. g., host, parasite, hyperparasite, symbionts, etc.) and by its interoperability through internal and external services.	['Web service', 'Desktop application']	[{'term': 'Data management', 'uri': 'http://edamontology.org/topic_3071'}, {'term': 'Evolutionary biology', 'uri': 'http://edamontology.org/topic_3299'}, {'term': 'Microbiology', 'uri': 'http://edamontology.org/topic_3301'}, {'term': 'Plant biology', 'uri': 'http://edamontology.org/topic_0780'}, {'term': 'Zoology', 'uri': 'http://edamontology.org/topic_3500'}, {'term': 'Experimental design and studies', 'uri': 'http://edamontology.org/topic_3678'}, {'term': 'Animal study', 'uri': 'http://edamontology.org/topic_3679'}, {'term': 'Imaging', 'uri': 'http://edamontology.org/topic_3382'}, {'term': 'Genomics', 'uri': 'http://edamontology.org/topic_0622'}, {'term': 'Data management', 'uri': 'http://edamontology.org/topic_3071'}]	[{'data': {'term': 'ecological data', 'uri': 'http://edamontology.org/data_3736'}, 'format': {'term': 'textual format', 'uri': 'http://edamontology.org/format_2330'}}]	[{'data': {'term': 'ecological data', 'uri': 'http://edamontology.org/data_3736'}, 'format': {'term': 'textual format', 'uri': 'http://edamontology.org/format_2330'}}]
diversitycollection	DiversityCollection (DWB-DC) is an application of the Diversity Workbench (DWB). It might be installed as part of a DWB environment, but also as a stand-alone application, e. g., in a local installation. Each DWB module is devoted to a specific data domain. DC is designed for data describing collection events, collections, collection vouchers and specimens, parts of specimens, as well as observation and occurrence data with assigned multimedia objects and documents. It is processing any action concerning the gathering, storage, transaction and treatment of specimens in a collection and is also appropriate to store observation data with analyses added. DC is unique among  collection management systems by its focus on biological relations between organisms linked together as one or more specimens or observations (e. g., host, parasite, hyperparasite, symbionts, etc.) and by its interoperability through internal and external services.	['Web service', 'Desktop application']	[{'term': 'Data management', 'uri': 'http://edamontology.org/topic_3071'}, {'term': 'Evolutionary biology', 'uri': 'http://edamontology.org/topic_3299'}, {'term': 'Microbiology', 'uri': 'http://edamontology.org/topic_3301'}, {'term': 'Plant biology', 'uri': 'http://edamontology.org/topic_0780'}, {'term': 'Zoology', 'uri': 'http://edamontology.org/topic_3500'}, {'term': 'Experimental design and studies', 'uri': 'http://edamontology.org/topic_3678'}, {'term': 'Animal study', 'uri': 'http://edamontology.org/topic_3679'}, {'term': 'Imaging', 'uri': 'http://edamontology.org/topic_3382'}, {'term': 'Genomics', 'uri': 'http://edamontology.org/topic_0622'}, {'term': 'Data management', 'uri': 'http://edamontology.org/topic_3071'}]	[{'data': {'term': 'ecological data', 'uri': 'http://edamontology.org/data_3736'}, 'format': {'term': 'textual format', 'uri': 'http://edamontology.org/format_2330'}}]	[{'data': {'term': 'ecological data', 'uri': 'http://edamontology.org/data_3736'}, 'format': {'term': 'textual format', 'uri': 'http://edamontology.org/format_2330'}}]
orphadata	A comprehensive, high-quality and freely-accessible dataset related to rare diseases and orphan drugs, in a reusable format.	['SPARQL endpoint', 'Database portal', 'Web API']	[{'term': 'Rare diseases', 'uri': 'http://edamontology.org/topic_3325'}, {'term': 'Ontology and terminology', 'uri': 'http://edamontology.org/topic_0089'}, {'term': 'Literature and language', 'uri': 'http://edamontology.org/topic_3068'}]	[{'data': {'term': 'name', 'uri': 'http://edamontology.org/data_2099'}, 'format': {'term': 'plain text format (unformatted)', 'uri': 'http://edamontology.org/format_1964'}}]	[{'data': {'term': 'name', 'uri': 'http://edamontology.org/data_2099'}, 'format': {'term': 'plain text format (unformatted)', 'uri': 'http://edamontology.org/format_1964'}}]
orphadata	A comprehensive, high-quality and freely-accessible dataset related to rare diseases and orphan drugs, in a reusable format.	['SPARQL endpoint', 'Database portal', 'Web API']	[{'term': 'Rare diseases', 'uri': 'http://edamontology.org/topic_3325'}, {'term': 'Ontology and terminology', 'uri': 'http://edamontology.org/topic_0089'}, {'term': 'Literature and language', 'uri': 'http://edamontology.org/topic_3068'}]	[{'data': {'term': 'name', 'uri': 'http://edamontology.org/data_2099'}, 'format': {'term': 'plain text format (unformatted)', 'uri': 'http://edamontology.org/format_1964'}}]	[{'data': {'term': 'name', 'uri': 'http://edamontology.org/data_2099'}, 'format': {'term': 'plain text format (unformatted)', 'uri': 'http://edamontology.org/format_1964'}}]
hgt-id	Identifies the integration of viruses into the human genome using the sequencing data.	['Workflow']	[{'term': 'Viral genomics', 'uri': 'http://edamontology.org/topic_0622'}, {'term': 'Sequencing', 'uri': 'http://edamontology.org/topic_3168'}, {'term': 'Whole genome sequencing', 'uri': 'http://edamontology.org/topic_3673'}, {'term': 'Cancer', 'uri': 'http://edamontology.org/topic_2640'}, {'term': 'RNA-seq', 'uri': 'http://edamontology.org/topic_3170'}]	[]	[]
bioexcel genome sequence quality control workflow	Workflow to perform high throughput Next Generation Sequencing (NGS) sequencing quality control stages	['Command-line tool', 'Library', 'Workflow']	[{'term': 'Sequence analysis', 'uri': 'http://edamontology.org/topic_0080'}]	[{'data': {'term': 'sequence', 'uri': 'http://edamontology.org/data_2044'}, 'format': {'term': 'fastq', 'uri': 'http://edamontology.org/format_1930'}}]	[{'data': {'term': 'sequence', 'uri': 'http://edamontology.org/data_2044'}, 'format': {'term': 'fastq', 'uri': 'http://edamontology.org/format_1930'}}]
rnaindel	"discovering somatic coding indels from tumor RNA-Seq data.

Somatic indel discovery tool for tumor RNA-Seq data.

RNAIndel calls coding indels from tumor RNA-Seq data and classifies them as somatic, germline, and artifactual. You can also use RNAIndel as a postprocessor to classify indels called by your own caller. RNAIndel supports GRCh38 and 37"	[]	[{'term': 'RNA-Seq', 'uri': 'http://edamontology.org/topic_3170'}, {'term': 'DNA polymorphism', 'uri': 'http://edamontology.org/topic_2885'}, {'term': 'Machine learning', 'uri': 'http://edamontology.org/topic_3474'}]	[]	[]
imgt, the international immunogenetics information system	IMGT®, the international ImMunoGeneTics information system® is the global reference in immunogenetics and immunoinformatics, created in 1989 by Marie-Paule Lefranc (Université de Montpellier and CNRS). IMGT® is a high-quality integrated knowledge resource specialized in the immunoglobulins (IG) or antibodies, T cell receptors (TR), major histocompatibility (MH) of human and other vertebrate species, and in the immunoglobulin superfamily (IgSF), MH superfamily (MhSF) and related proteins of the immune system (RPI) of vertebrates and invertebrates. IMGT® provides a common access to sequence, genome and structure Immunogenetics data, based on the concepts of IMGT-ONTOLOGY and on the IMGT Scientific chart rules. IMGT® works in close collaboration with EBI (Europe), DDBJ (Japan) and NCBI (USA). IMGT® consists of sequence databases, genome database, structure database, and monoclonal antibodies database, Web resources and interactive tools.	['Ontology', 'Web application', 'Database portal', 'Bioinformatics portal']	[{'term': 'Immunoinformatics', 'uri': 'http://edamontology.org/topic_3948'}, {'term': 'Immunogenetics', 'uri': 'http://edamontology.org/topic_3930'}]	[]	[]
imgt, the international immunogenetics information system	IMGT®, the international ImMunoGeneTics information system® is the global reference in immunogenetics and immunoinformatics, created in 1989 by Marie-Paule Lefranc (Université de Montpellier and CNRS). IMGT® is a high-quality integrated knowledge resource specialized in the immunoglobulins (IG) or antibodies, T cell receptors (TR), major histocompatibility (MH) of human and other vertebrate species, and in the immunoglobulin superfamily (IgSF), MH superfamily (MhSF) and related proteins of the immune system (RPI) of vertebrates and invertebrates. IMGT® provides a common access to sequence, genome and structure Immunogenetics data, based on the concepts of IMGT-ONTOLOGY and on the IMGT Scientific chart rules. IMGT® works in close collaboration with EBI (Europe), DDBJ (Japan) and NCBI (USA). IMGT® consists of sequence databases, genome database, structure database, and monoclonal antibodies database, Web resources and interactive tools.	['Ontology', 'Web application', 'Database portal', 'Bioinformatics portal']	[{'term': 'Immunoinformatics', 'uri': 'http://edamontology.org/topic_3948'}, {'term': 'Immunogenetics', 'uri': 'http://edamontology.org/topic_3930'}]	[]	[]
vastdb	An atlas of alternative splicing profiles in vertebrate cell and tissue types	['Database portal']	[{'term': 'RNA splicing', 'uri': 'http://edamontology.org/topic_3320'}, {'term': 'RNA-seq', 'uri': 'http://edamontology.org/topic_3170'}]	[{'data': {'term': 'gene identifier', 'uri': 'http://edamontology.org/data_1025'}, 'format': {'term': 'textual format', 'uri': 'http://edamontology.org/format_2330'}}]	[{'data': {'term': 'gene identifier', 'uri': 'http://edamontology.org/data_1025'}, 'format': {'term': 'textual format', 'uri': 'http://edamontology.org/format_2330'}}]
caw	Project has changed name: sarek	['Command-line tool', 'Workflow']	[{'term': 'Oncology', 'uri': 'http://edamontology.org/topic_2640'}, {'term': 'Genomics', 'uri': 'http://edamontology.org/topic_0622'}]	[{'data': {'term': 'dna sequence (raw)', 'uri': 'http://edamontology.org/data_3497'}, 'format': {'term': 'fastq', 'uri': 'http://edamontology.org/format_1930'}}]	[{'data': {'term': 'dna sequence (raw)', 'uri': 'http://edamontology.org/data_3497'}, 'format': {'term': 'fastq', 'uri': 'http://edamontology.org/format_1930'}}]
sequence similarity maps (ssm)	A data mining solution to map thousands of viral isolates (influenza, dengue and FMDV virus).	['Web application']	[{'term': 'Proteomics', 'uri': 'http://edamontology.org/topic_0121'}]	[]	[]
isotopident	Isotopident can estimate the theoretical isotopic distribution of a peptide or protein, a polynucleotide and a chemical compound from its composition (sequence of amino acids expressed in either 1-letter code, sequence of amino acids expressed in 3-letter code, sequence of nucleotides or its chemical formula). Isotopident can also compute its monoisotopic mass. and predict the most likely isotope combination and the exact mass of the given input.	['Web application']	[{'term': 'Proteomics', 'uri': 'http://edamontology.org/topic_0121'}, {'term': 'Genomics', 'uri': 'http://edamontology.org/topic_0622'}, {'term': 'Proteomics experiment', 'uri': 'http://edamontology.org/topic_3520'}]	[]	[]
pavian	Web application for exploring metagenomics classification results, with a special focus on infectious disease diagnosis. Pinpointing pathogens in metagenomics classification results is often complicated by host and laboratory contaminants as well as many non-pathogenic microbiota. Researchers can analyze, display and transform results from the Kraken and Centrifuge classifiers using interactive tables, heatmaps and flow diagrams.	['Web application']	[{'term': 'Metagenomics', 'uri': 'http://edamontology.org/topic_3174'}, {'term': 'Model organisms', 'uri': 'http://edamontology.org/topic_0621'}]	[]	[]
elmmo	A website to browse miRNA target predictions from the ElMMo algorithm	['Web application', 'Database portal']	[{'term': 'Transcriptomics', 'uri': 'http://edamontology.org/topic_3308'}]	[]	[]
iscan	A package to identify insertion sequences and similar transposable elements, their inverted repeats, and the direct target repeats they generate in entire genomes.	['Web application']	[{'term': 'Genomics', 'uri': 'http://edamontology.org/topic_0622'}]	[]	[]
