name	description	type	topic	input	output
onassis	A package that allows the annotation of text with ontology terms (mainly from OBO ontologies) and the computation of semantic similarity measures based on the structure of the ontology between different annotated samples.	['Library']	[{'term': 'Ontology and terminology', 'uri': 'http://edamontology.org/topic_0089'}]	[]	[]
geseq	Rapid and accurate annotation of organellar genome sequences, in particular chloroplast genomes.	['Web application']	[{'term': 'Sequence sites, features and motifs', 'uri': 'http://edamontology.org/topic_0160'}, {'term': 'Gene transcripts', 'uri': 'http://edamontology.org/topic_3512'}, {'term': 'Phylogenetics', 'uri': 'http://edamontology.org/topic_3293'}]	[{'data': {'term': 'sequence', 'uri': 'http://edamontology.org/data_2044'}, 'format': {'term': 'fasta', 'uri': 'http://edamontology.org/format_1929'}}]	[{'data': {'term': 'sequence', 'uri': 'http://edamontology.org/data_2044'}, 'format': {'term': 'fasta', 'uri': 'http://edamontology.org/format_1929'}}]
enrichplot	Visualization methods for interpreting functional enrichment results obtained from ORA or GSEA analysis. All the visualization methods are developed based on 'ggplot2' graphics.	['Library']	[{'term': 'Biology', 'uri': 'http://edamontology.org/topic_3070'}]	[]	[]
annotationfilter	It provides class and other infrastructure to implement filters for manipulating Bioconductor annotation resources. The filters will be used by ensembldb, Organism.dplyr, and other packages.	['Library']	[{'term': 'Data submission, annotation and curation', 'uri': 'http://edamontology.org/topic_0219'}]	[]	[]
delayedarray	Wrapping an array-like object in a DelayedArray object allows one to perform common array operations on it without loading the object in memory. In order to reduce memory usage and optimize performance, operations on the object are either delayed or executed using a block processing mechanism. Note that this also works on in-memory array-like objects like DataFrame objects, Matrix objects, and ordinary arrays and data frames.	['Library']	[{'term': 'Data management', 'uri': 'http://edamontology.org/topic_3071'}]	[]	[]
decres	DEep learning for identifying Cis-Regulatory ElementS is an extension of the Deep Learning Tutorials developped by LISA lab (www.deeplearning.net/tutorial/). Although it is developped for the identification of CREs, it can also be used for other applications.	['Library', 'Script']	[{'term': 'Enhancers', 'uri': 'http://edamontology.org/topic_0749'}, {'term': 'Transcriptional regulatory sites', 'uri': 'http://edamontology.org/topic_0749'}, {'term': 'Promoters', 'uri': 'http://edamontology.org/topic_0749'}]	[]	[]
nadfinder	This Bioconductor package has been developed for bioinformatic analysis of the NAD-seq data, including normalization, smoothing, peak calling, peak trimming and annotation.	['Library']	[{'term': 'Sequencing', 'uri': 'http://edamontology.org/topic_3168'}, {'term': 'Gene regulation', 'uri': 'http://edamontology.org/topic_0204'}]	[]	[]
kbase	The first large-scale bioinformatics system that enables users to upload their own data, analyze it (along with collaborator and public data), build increasingly realistic models, and share and publish their workflows and conclusions. KBase aims to provide a knowledgebase: an integrated environment where knowledge and insights are created and multiplied.	['Workflow']	[{'term': 'Comparative genomics', 'uri': 'http://edamontology.org/topic_0797'}]	[]	[]
j-express	It is a comprehensive portable software package for analysis and visualization of microarray data. It gives access to methods for unsupervised analysis, supervised analysis and visualisation in an integrated and flexible way. Its efficiency allows interactive clustering of thousands of expression profiles on standard personal computers. Supervised analysis can be performed on samples by simple sample annotation or on genes through tools for metabolic pathway analysis and Gene Ontology mapping.	['Desktop application']	[{'term': 'Ontology and terminology', 'uri': 'http://edamontology.org/topic_0089'}, {'term': 'Mapping', 'uri': 'http://edamontology.org/topic_0102'}, {'term': 'samples', 'uri': 'http://edamontology.org/topic_3277'}]	[]	[]
qsbio	A dataset of conserved quaternary structure (QS) across Protein Data Ban (PDB).	['Database portal']	[{'term': 'Structure analysis', 'uri': 'http://edamontology.org/topic_0081'}, {'term': 'Structural biology', 'uri': 'http://edamontology.org/topic_1317'}]	[]	[]
feelnc	A tool to annotate long non-coding RNAs from RNA-seq assembled transcripts.	['Command-line tool']	[{'term': 'RNA-seq', 'uri': 'http://edamontology.org/topic_3170'}, {'term': 'Functional, regulatory and non-coding RNA', 'uri': 'http://edamontology.org/topic_0659'}]	[]	[]
defume	Assemble Sanger sequencing reads, identify ORFs and blast these as well as annotating them with InterPro.	['Web service']	[{'term': 'Sequencing', 'uri': 'http://edamontology.org/topic_3168'}, {'term': 'Sequence analysis', 'uri': 'http://edamontology.org/topic_0080'}]	[]	[]
mambo	MAMBO (Metabolomic Analysis of Metagenomes using fBa and Optimization) is an algorithm which assesses and optimizes correlations between genome-scale, constraint-based metabolic models and microbial abundance profiles obtained from shotgun sequence data.	['Command-line tool']	[{'term': 'Metagenomics', 'uri': 'http://edamontology.org/topic_3174'}, {'term': 'Microbial ecology', 'uri': 'http://edamontology.org/topic_3697'}, {'term': 'Metabolomics', 'uri': 'http://edamontology.org/topic_3172'}, {'term': 'Data mining', 'uri': 'http://edamontology.org/topic_3473'}]	[{'data': {'term': 'data reference', 'uri': 'http://edamontology.org/data_2093'}}]	[{'data': {'term': 'data reference', 'uri': 'http://edamontology.org/data_2093'}}]
higdb	Bacteriological, clinical, genomic and proteomic database of H. influenzae.	['Database portal']	[{'term': 'Microbiology', 'uri': 'http://edamontology.org/topic_3301'}, {'term': 'Virology', 'uri': 'http://edamontology.org/topic_0781'}]	[]	[]
ratt	Transfer annotation from a reference (annotated) genome to an unannotated query genome. It is able to transfer any entry present on a reference sequence, such as the systematic id or an annotator’s notes.	['Command-line tool']	[{'term': 'Assembly', 'uri': 'http://edamontology.org/topic_0196'}, {'term': 'DNA', 'uri': 'http://edamontology.org/topic_0654'}]	[]	[]
ahtpdb	Manually curated database of experimentally validated Antihypertensive peptides (AHTPs) with comprehensive information  that includes: sequence, inhibitory concentration (IC50), log value of inhibitory concentration (pIC50) and toxicity.	['Database portal']	[{'term': 'Pharmacology', 'uri': 'http://edamontology.org/topic_0202'}, {'term': 'Medicines research and development', 'uri': 'http://edamontology.org/topic_3376'}]	[]	[]
compendium of protein lysine acetylation (cpla)	Resource of manually curated lysine acetylated substrates with their sites.	['Database portal']	[{'term': 'Proteins', 'uri': 'http://edamontology.org/topic_0078'}, {'term': 'Protein modifications', 'uri': 'http://edamontology.org/topic_0601'}, {'term': 'Epigenetics', 'uri': 'http://edamontology.org/topic_3295'}, {'term': 'Protein interactions', 'uri': 'http://edamontology.org/topic_0128'}]	[]	[]
aceparser	AceParser: Parse an Ace file (Phred/Phrap output) into a tab-delimited assembly alignment file. Options to include embedded annotation from multiple sources.	['Command-line tool']	[{'term': 'Assembly', 'uri': 'http://edamontology.org/topic_0196'}]	[]	[]
quin	Tool for visualizing, annotating, and querying chromatin interactions derived from technologies such as ChIA-PET or HiC.	['Web application']	[{'term': 'Data visualisation', 'uri': 'http://edamontology.org/topic_0092'}, {'term': 'Molecular interactions, pathways and networks', 'uri': 'http://edamontology.org/topic_0602'}]	[]	[]
kinetoplastid genome resources (tritrypdb)	Integrated database providing access to genome-scale datasets for kinetoplastid parasites. Integrates datasets from Leishmania braziliensis, L. infantum, L. major, L. tarentolae, Trypanosoma brucei and T. cruzi. Users may examine individual genes or chromosomal spans in their genomic context, including syntenic alignments with other kinetoplastid organisms. Data can be interrogated utilizing a search strategy system that enables a user to construct complex queries combining multiple data types.	['Database portal']	[{'term': 'Model organisms', 'uri': 'http://edamontology.org/topic_0621'}, {'term': 'Model organisms', 'uri': 'http://edamontology.org/topic_0621'}, {'term': 'Animals', 'uri': 'http://edamontology.org/topic_3500'}, {'term': 'Model organisms', 'uri': 'http://edamontology.org/topic_0621'}]	[]	[]
bugbuilder	BugBuilder is a pipeline for the automated assembly and annotation of microbial genomes from high-throughput sequence data. It is configurable so as not to be tied to any assembler or scaffolder, and is designed to run in a cluster environment facilitating high-throughput processing of genomes.	['Command-line tool']	[{'term': 'Assembly', 'uri': 'http://edamontology.org/topic_0196'}]	[]	[]
grasp	GRASP is a gene annotation tool for metagenomic studies. GRASP assembles the fragmented short-peptides, which are called from the NGS reads, and aligns the assembled contigs to the query reference protein. GRASP achieves much higher sensitivity than BLASTP for gene annotation purpose.	['Command-line tool']	[{'term': 'NGS', 'uri': 'http://edamontology.org/topic_3168'}, {'term': 'Assembly', 'uri': 'http://edamontology.org/topic_0196'}, {'term': 'Peptides', 'uri': 'http://edamontology.org/topic_0154'}, {'term': 'Studies', 'uri': 'http://edamontology.org/topic_3678'}]	[]	[]
pint	Pathway INtegration Tool (PINT) allows integration and annotation of systems biology markup language (SBML) files from a variety of sources. Gene list files are also accepted.	['Web application']	[{'term': 'Molecular interactions, pathways and networks', 'uri': 'http://edamontology.org/topic_0602'}, {'term': 'Systems biology', 'uri': 'http://edamontology.org/topic_2259'}, {'term': 'Model organisms', 'uri': 'http://edamontology.org/topic_0621'}]	[]	[]
guide	Guide (Genome Informatics Data Explorer) is a desktop application designed for the bench biologists to analyse RNA-Seq and microarray expression data. It performs gene-centric analyses such as differential expression and pathways using well-established R modules. It also integrates useful data from multiple sources, such as gene annotation and orthologue data, and enables editing of R commands to customise the analyses for advanced users.	['Desktop application']	[{'term': 'Gene expression', 'uri': 'http://edamontology.org/topic_0203'}, {'term': 'RNA', 'uri': 'http://edamontology.org/topic_0099'}, {'term': 'RNA-seq', 'uri': 'http://edamontology.org/topic_3170'}, {'term': 'Pathways', 'uri': 'http://edamontology.org/topic_0602'}, {'term': 'RNA-seq', 'uri': 'http://edamontology.org/topic_3170'}]	[]	[]
webapollo	Browser-based tool for distributed community annotation of sequences.	['Plug-in']	[{'term': 'Genomics', 'uri': 'http://edamontology.org/topic_0622'}]	[]	[]
becas	Web application, API and widget for biomedical concept identification. It helps researchers, healthcare professionals and developers in the identification of over 1,200,000 biomedical concepts in text and PubMed abstracts.	['Web application']	[{'term': 'Data submission, annotation and curation', 'uri': 'http://edamontology.org/topic_0219'}, {'term': 'Biomedical science', 'uri': 'http://edamontology.org/topic_3344'}, {'term': 'Literature and language', 'uri': 'http://edamontology.org/topic_3068'}]	[]	[]
david bioinformatics resources	The Database for Annotation, Visualization and Integrated Discovery (DAVID) provides a comprehensive set of functional annotation tools for investigators to understand biological meaning behind large list of genes.	['Web application']	[{'term': 'Pathology', 'uri': 'http://edamontology.org/topic_0634'}, {'term': 'Molecular interactions, pathways and networks', 'uri': 'http://edamontology.org/topic_0602'}, {'term': 'Mapping', 'uri': 'http://edamontology.org/topic_0102'}, {'term': 'Data mining', 'uri': 'http://edamontology.org/topic_3473'}]	[]	[]
cddapp	Cytoscape3 extension that supports the annotation of protein networks with information about domains and specific functional sites (features) from the National Center for Biotechnology Information (NCBI) Conserved Domain Database (CDD).	['Desktop application']	[{'term': 'Systems biology', 'uri': 'http://edamontology.org/topic_2259'}, {'term': 'Biotechnology', 'uri': 'http://edamontology.org/topic_3297'}, {'term': 'Sequence sites, features and motifs', 'uri': 'http://edamontology.org/topic_0160'}, {'term': 'Molecular interactions, pathways and networks', 'uri': 'http://edamontology.org/topic_0602'}]	[]	[]
dnatraffic	Database dedicated to comprehensive and rich annotations of genome dynamics during cell life. DNAtraffic contains extensive data on the nomenclature, ontology, structure and function of proteins related to control of the DNA integrity mechanisms such as chromatin remodeling, DNA repair and damage response pathways from eight model organisms commonly used in the DNA-related study.	['Database portal']	[{'term': 'Epigenetics', 'uri': 'http://edamontology.org/topic_3295'}, {'term': 'Model organisms', 'uri': 'http://edamontology.org/topic_0621'}, {'term': 'Ontology and terminology', 'uri': 'http://edamontology.org/topic_0089'}, {'term': 'Molecular interactions, pathways and networks', 'uri': 'http://edamontology.org/topic_0602'}, {'term': 'Pathology', 'uri': 'http://edamontology.org/topic_0634'}]	[]	[]
mg-rast	MG-RAST is a fully-automated service for annotating metagenome samples providing analysis tools for comparison	['Web application']	[{'term': 'Metagenomics', 'uri': 'http://edamontology.org/topic_3174'}, {'term': 'Phylogenetics', 'uri': 'http://edamontology.org/topic_3293'}]	[]	[]
dbcan	dbCAN provides automated carbohydrate-active enzyme signature domain-based annotation for a set of proteins. Each carbohydrate-active enzyme has an assigned signature domain.	['Web application']	[{'term': 'Enzymes', 'uri': 'http://edamontology.org/topic_0821'}, {'term': 'Sequence sites, features and motifs', 'uri': 'http://edamontology.org/topic_0160'}, {'term': 'Protein folds and structural domains', 'uri': 'http://edamontology.org/topic_0736'}, {'term': 'Carbohydrates', 'uri': 'http://edamontology.org/topic_0152'}, {'term': 'Gene and protein families', 'uri': 'http://edamontology.org/topic_0623'}]	[]	[]
a4preproc	"An R package of the ""a4"" packages collection. It is used for microarray data preprocessing where annotation information is added to experimental result data."	['Command-line tool', 'Library']	[{'term': 'Microarray experiment', 'uri': 'http://edamontology.org/topic_3518'}, {'term': 'Ontology and terminology', 'uri': 'http://edamontology.org/topic_0089'}]	[]	[]
rast	"""RAST (Rapid Annotation using Subsystem Technology) is a fully-automated service for annotating complete or nearly complete bacterial and archaeal genomes. It provides high quality genome annotations for these genomes across the whole phylogenetic tree."""	['Web service']	[{'term': 'Genomics', 'uri': 'http://edamontology.org/topic_0622'}, {'term': 'Phylogenetics', 'uri': 'http://edamontology.org/topic_3293'}]	[]	[]
pcpheno	Tools to integrate, annotate, and link phenotypes to cellular organizational units such as protein complexes and pathways.	['Command-line tool', 'Library']	[{'term': 'Proteins', 'uri': 'http://edamontology.org/topic_0078'}, {'term': 'Molecular interactions, pathways and networks', 'uri': 'http://edamontology.org/topic_0602'}, {'term': 'Genotype and phenotype', 'uri': 'http://edamontology.org/topic_0625'}]	[]	[]
bior	Biological Repository is a toolkit and set of catalogs to retrieve genomic annotation for variants, genes, diseases, conditions, genetic tests, and drugs.	['Command-line tool']	[{'term': 'Genetics', 'uri': 'http://edamontology.org/topic_3053'}, {'term': 'Data submission, annotation and curation', 'uri': 'http://edamontology.org/topic_0219'}, {'term': 'Genomics', 'uri': 'http://edamontology.org/topic_0622'}]	[]	[]
biocatalogue	A universal catalogue of web services for the life sciences. BioCatalogue provides a common interface for registering, browsing and annotating web services to the life science community.	['Web application']	[{'term': 'Biology', 'uri': 'http://edamontology.org/topic_3070'}, {'term': 'Computational biology', 'uri': 'http://edamontology.org/topic_3307'}, {'term': 'Plant biology', 'uri': 'http://edamontology.org/topic_0780'}]	[]	[]
carmo	Web-based platform providing comprehensive annotations for multi-omics data, including transcriptomic data sets, epi-genomic modification sites, SNPs from genome re-sequencing, and the large gene lists derived from these omics studies.	['Web application']	[{'term': 'Preclinical and clinical studies', 'uri': 'http://edamontology.org/topic_3379'}, {'term': 'Omics', 'uri': 'http://edamontology.org/topic_3391'}, {'term': 'Sequencing', 'uri': 'http://edamontology.org/topic_3168'}]	[]	[]
est2assembly	Platform is the only platform for standardising transcriptome projects: go from raw trace files to an annotated GBrowse interface driven by the Seqfeature database. It accepts both Sanger and 454 sequencing technology for a denovo assembly, annotation and data mining of EST data.	['Command-line tool']	[{'term': 'Data mining', 'uri': 'http://edamontology.org/topic_3473'}, {'term': 'Gene transcripts', 'uri': 'http://edamontology.org/topic_3512'}, {'term': 'Transcriptomics', 'uri': 'http://edamontology.org/topic_3308'}, {'term': 'Sequence assembly', 'uri': 'http://edamontology.org/topic_0196'}, {'term': 'Sequencing', 'uri': 'http://edamontology.org/topic_3168'}]	[]	[]
flowrepositoryr	This package provides an interface to search and download data and annotations from FlowRepository (flowrepository.org). It uses the FlowRepository programming interface to communicate with a FlowRepository server.	['Command-line tool', 'Library']	[{'term': 'Cell biology', 'uri': 'http://edamontology.org/topic_2229'}]	[]	[]
fusionanalyser	Graphical, event-driven tool dedicated to the identification of driver fusion rearrangements in human cancer through the analysis of paired-end high-throughput transcriptome sequencing data. Requires short, paired-end sequences.	['Desktop application']	[{'term': 'Sequencing', 'uri': 'http://edamontology.org/topic_3168'}, {'term': 'Gene structure', 'uri': 'http://edamontology.org/topic_0114'}, {'term': 'Transcriptomics', 'uri': 'http://edamontology.org/topic_3308'}]	[]	[]
variant	Command line, web service, and web interface for fast and accurate functional characterization of variants found by Next Generation Sequencing.	['Command-line tool', 'Web application']	[{'term': 'Genomics', 'uri': 'http://edamontology.org/topic_0622'}]	[{'data': {'term': 'sequence', 'uri': 'http://edamontology.org/data_2044'}}]	[{'data': {'term': 'sequence', 'uri': 'http://edamontology.org/data_2044'}}]
variant	Command line, web service, and web interface for fast and accurate functional characterization of variants found by Next Generation Sequencing.	['Command-line tool', 'Web application']	[{'term': 'Genomics', 'uri': 'http://edamontology.org/topic_0622'}]	[{'data': {'term': 'sequence', 'uri': 'http://edamontology.org/data_2044'}}]	[{'data': {'term': 'sequence', 'uri': 'http://edamontology.org/data_2044'}}]
tableannotator	Tool for annotating tables written in Java. It uses specific annotation schema we proposed that is able to capture information about functions of a cell and inter-cell relationships. It is a tool for extracting annotations from tables in PMC and DailyMed in XML format.	['Command-line tool']	[{'term': 'Preclinical and clinical studies', 'uri': 'http://edamontology.org/topic_3379'}, {'term': 'Drug discovery', 'uri': 'http://edamontology.org/topic_3336'}]	[{'data': {'term': 'text data', 'uri': 'http://edamontology.org/data_2526'}, 'format': {'term': 'xml', 'uri': 'http://edamontology.org/format_2332'}}]	[{'data': {'term': 'text data', 'uri': 'http://edamontology.org/data_2526'}, 'format': {'term': 'xml', 'uri': 'http://edamontology.org/format_2332'}}]
dasir	R package for programmatic retrieval of information from DAS servers.	['Command-line tool', 'Plug-in']	[{'term': 'Computer science', 'uri': 'http://edamontology.org/topic_3316'}]	[{'data': {'term': 'identifier', 'uri': 'http://edamontology.org/data_0842'}}]	[{'data': {'term': 'identifier', 'uri': 'http://edamontology.org/data_0842'}}]
gominer ws	A tool for biological interpretation of microarray data.	['Web service']	[{'term': 'Data management', 'uri': 'http://edamontology.org/topic_3071'}]	[]	[]
biolabeler	Extract UMLS concepts from Biomedical texts such as scientific paper abstracts, experiments descriptions or medical notes and can be use to automatically curate and annotate BioMedical Literature.	['Web API']	[{'term': 'Data mining', 'uri': 'http://edamontology.org/topic_3473'}, {'term': 'Data management', 'uri': 'http://edamontology.org/topic_3071'}]	[]	[]
macie	Mechanism, Annotation, and Classification in Enzymes: database of enzyme reaction mechanisms.	['Database portal']	[{'term': 'Enzymes', 'uri': 'http://edamontology.org/topic_0821'}, {'term': 'Chemistry', 'uri': 'http://edamontology.org/topic_3314'}, {'term': 'Protein binding sites', 'uri': 'http://edamontology.org/topic_3534'}, {'term': 'Small molecules', 'uri': 'http://edamontology.org/topic_0154'}]	[]	[]
nlr-parser	Tool to rapidly annotate the NLR (nucleotide-binding leucine-rich repeat) complement from sequenced plant genomes.	['Command-line tool']	[{'term': 'Plant biology', 'uri': 'http://edamontology.org/topic_0780'}, {'term': 'Genomics', 'uri': 'http://edamontology.org/topic_0622'}, {'term': 'Pathology', 'uri': 'http://edamontology.org/topic_0634'}]	[]	[]
descseq	Alter the name or description of a sequence.	['Command-line tool']	[{'term': 'Data management', 'uri': 'http://edamontology.org/topic_3071'}]	[{'data': {'term': 'sequence record', 'uri': 'http://edamontology.org/data_0849'}}]	[{'data': {'term': 'sequence record', 'uri': 'http://edamontology.org/data_0849'}}]
ddbj	Nucleotide sequence archive database and accompanying database tools for sequence submission, entry retrieval and annotation analysis. A new archive for quantitative genomics data, the DDBJ Omics aRchive (DOR). The DOR stores quantitative data both from the microarray and high-throughput new sequencing platforms. Other improvements include improved content of the patent sequence, released a new submission tool of the Sequence Read Archive (DRA) and the Read Annotation Pipeline.	['Database portal']	[{'term': 'Database management', 'uri': 'http://edamontology.org/topic_3489'}, {'term': 'Gene transcripts', 'uri': 'http://edamontology.org/topic_3512'}, {'term': 'Microarray experiment', 'uri': 'http://edamontology.org/topic_3518'}, {'term': 'Sequencing', 'uri': 'http://edamontology.org/topic_3168'}]	[]	[]
mir-prefer	Uses expression patterns of miRNA and follows the criteria for plant microRNA annotation to accurately predict plant miRNAs from one or more small RNA-Seq data samples of the same species.	['Command-line tool']	[{'term': 'RNA-Seq', 'uri': 'http://edamontology.org/topic_3170'}, {'term': 'Functional, regulatory and non-coding RNA', 'uri': 'http://edamontology.org/topic_0659'}, {'term': 'RNA', 'uri': 'http://edamontology.org/topic_0099'}]	[]	[]
mpagenomics	A package for multi-patients analysis of genomic markers. It is devoted to (i) efficient segmentation and (ii) genomic marker selection from multi-patient copy number and SNP data profiles.	['Workbench']	[{'term': 'Statistics and probability', 'uri': 'http://edamontology.org/topic_2269'}, {'term': 'Gene expression', 'uri': 'http://edamontology.org/topic_0203'}, {'term': 'DNA polymorphism', 'uri': 'http://edamontology.org/topic_2885'}]	[{'data': {'term': 'raw microarray data', 'uri': 'http://edamontology.org/data_3110'}}]	[{'data': {'term': 'raw microarray data', 'uri': 'http://edamontology.org/data_3110'}}]
phenotator	Enter phenotypes descriptions and annotate these description with ontology terms using the entity/quality (EQ) pattern.	['Web application']	[{'term': 'Ontology and terminology', 'uri': 'http://edamontology.org/topic_0089'}, {'term': 'Data management', 'uri': 'http://edamontology.org/topic_3071'}]	[]	[]
bubastis	An ontology change tool which is able to analyse two ontologies (typically two versions of the same ontology) to highlight logical changes which have occurred and to present these changes in more or less detail, as required.	['Web application']	[{'term': 'Ontology and terminology', 'uri': 'http://edamontology.org/topic_0089'}, {'term': 'Gene expression', 'uri': 'http://edamontology.org/topic_0203'}, {'term': 'Natural language processing', 'uri': 'http://edamontology.org/topic_0218'}, {'term': 'Data governance', 'uri': 'http://edamontology.org/topic_3571'}]	[{'data': {'term': 'ontology', 'uri': 'http://edamontology.org/data_0582'}}]	[{'data': {'term': 'ontology', 'uri': 'http://edamontology.org/data_0582'}}]
pannzer	Fully automated service for functional annotation of prokaryotic and eukaryotic proteins of unknown function. The tool is designed to predict the functional description (DE), EC numbers and GO classes.	['Command-line tool']	[{'term': 'Proteins', 'uri': 'http://edamontology.org/topic_0078'}, {'term': 'Function analysis', 'uri': 'http://edamontology.org/topic_1775'}, {'term': 'Sequence analysis', 'uri': 'http://edamontology.org/topic_0080'}]	[]	[]
